productId,status,title,displayName,brand,groupId,variant,series,size,packSize,flavour,format,strength,ageRange,gender,keywordsExtra,imageUrl,priority,lastUpdated,notes
4486289570.0,active,TT TRAINER STR CUP 6M+ 300ML,Tommee Tippee Trainer Straw Cup 6m+ 300ml,Tommee Tippee,tt-cups,Trainer,,300ml,1 pack,,straw cup,,6m+,Unisex,trainer straw cup,,70,2026-05-01,
8482409563.0,active,TT STARTER SPOUT CUP 4M+ 240ML,Tommee Tippee Starter Spout Cup 4m+ 240ml,Tommee Tippee,tt-cups,Starter,,240ml,1 pack,,spout cup,,4m+,Unisex,starter spout cup,,70,2026-05-01,
8840679594.0,active,TT ACTIVE STR CUP 12M 390ML,Tommee Tippee Active Straw Cup 12m+ 390ml,Tommee Tippee,tt-cups,Active,,390ml,1 pack,,straw cup,,12m+,Unisex,active straw cup,,70,2026-05-01,
8808409587.0,active,TT OTG STRW CUP 18M 500ML,Tommee Tippee On The Go Straw Cup 18m+ 500ml,Tommee Tippee,tt-cups,On The Go,,500ml,1 pack,,straw cup,,18m+,Unisex,otg on the go,,70,2026-05-01,
6675650409.0,active,TT PEN DIGITAL THERMOMETER,Tommee Tippee Pen Digital Thermometer,Tommee Tippee,tt-cups,,,,1 pack,,thermometer,,,Unisex,digital thermometer temperature,,70,2026-05-01,
9276198634.0,active,TT FRESH FOOD FEEDER NEW,Tommee Tippee Fresh Food Feeder,Tommee Tippee,tt-cups,,,,1 pack,,food feeder,,6m+,Unisex,fresh food feeder,,70,2026-05-01,
2246700606.0,active,TT BOTTLE NOVELTY/YH 250M,Tommee Tippee Novelty Bottle 250ml,Tommee Tippee,tt-bottles-pumps,Novelty,,250ml,1 pack,,bottle,,,Unisex,novelty bottle,,70,2026-05-01,
1867001163.0,active,TT C2N BOTTLE AND TEAT BRUSH,Tommee Tippee Closer to Nature Bottle and Teat Brush,Tommee Tippee,tt-bottles-pumps,,Closer to Nature,,1 pack,,brush,,,Unisex,bottle brush teat brush,,70,2026-05-01,
1911825303.0,active,TT MLK FEEDING BIB 2PK,Tommee Tippee Milk Feeding Bib 2 Pack,Tommee Tippee,tt-bottles-pumps,,,2 pack,2 pack,,bib,,,Unisex,feeding bib,,70,2026-05-01,
8507666361.0,active,TT U/L SIL SOOTH 18-36M 2P,Tommee Tippee Ultra Light Silicone Soother 18-36m 2 Pack,Tommee Tippee,tt-teats-soothers,Ultra Light,,,2 pack,,soother,,18-36m,Unisex,ultra light silicone,,70,2026-05-01,
7055270982.0,active,TT U/L SIL SOOTH 6-18M 2PK,Tommee Tippee Ultra Light Silicone Soother 6-18m 2 Pack,Tommee Tippee,tt-teats-soothers,Ultra Light,,,2 pack,,soother,,6-18m,Unisex,ultra light silicone,,70,2026-05-01,
1666270147.0,active,TT C2N NGT TIME SOOTH 0-6M 2PK,Tommee Tippee Closer to Nature Night Time Soother 0-6m 2 Pack,Tommee Tippee,tt-teats-soothers,Night Time,Closer to Nature,,2 pack,,soother,,0-6m,Unisex,night glow,,70,2026-05-01,
1886440164.0,active,TT C2N NGT TIME SOOTH 6-18M 2P,Tommee Tippee Closer to Nature Night Time Soother 6-18m 2 Pack,Tommee Tippee,tt-teats-soothers,Night Time,Closer to Nature,,2 pack,,soother,,6-18m,Unisex,night glow,,70,2026-05-01,
2597700185.0,active,TT C2N NGT TIME SOOTH 18-36M 2P,Tommee Tippee Closer to Nature Night Time Soother 18-36m 2 Pack,Tommee Tippee,tt-teats-soothers,Night Time,Closer to Nature,,2 pack,,soother,,18-36m,Unisex,night glow,,70,2026-05-01,
7580335975.0,active,TT U/L SIL SOOTH 0-6M 2PK,Tommee Tippee Ultra Light Silicone Soother 0-6m 2 Pack,Tommee Tippee,tt-teats-soothers,Ultra Light,,,2 pack,,soother,,0-6m,Unisex,ultra light silicone,,70,2026-05-01,
6353506187.0,active,TT U/L NT SIL SOOTH 0-6M NEW,Tommee Tippee Ultra Light Night Time Silicone Soother 0-6m,Tommee Tippee,tt-teats-soothers,Ultra Light Night Time,,,1 pack,,soother,,0-6m,Unisex,night time,,70,2026-05-01,
8578336200.0,active,TT U/L NT SIL SOOTH 18-36M NEW,Tommee Tippee Ultra Light Night Time Silicone Soother 18-36m,Tommee Tippee,tt-teats-soothers,Ultra Light Night Time,,,1 pack,,soother,,18-36m,Unisex,night time,,70,2026-05-01,
4558845845.0,active,TT SOFT/CHEW TEETHER,Tommee Tippee Soft Chew Teether,Tommee Tippee,tt-teats-soothers,Soft Chew,,,1 pack,,teether,,,Unisex,chew teether,,70,2026-05-01,
6878655326.0,active,TT CHERRY LTX SOOTH 0-6M 2PK,Tommee Tippee Cherry Latex Soother 0-6m 2 Pack,Tommee Tippee,tt-teats-soothers,Cherry Latex,,,2 pack,,soother,,0-6m,Unisex,latex cherry,,70,2026-05-01,
6871825333.0,active,TT CHERRY LTX SOOTH 6-18M 2PK,Tommee Tippee Cherry Latex Soother 6-18m 2 Pack,Tommee Tippee,tt-teats-soothers,Cherry Latex,,,2 pack,,soother,,6-18m,Unisex,latex cherry,,70,2026-05-01,
7619685340.0,active,TT CHERRY LTX SOOTH 18-36M 2PK,Tommee Tippee Cherry Latex Soother 18-36m 2 Pack,Tommee Tippee,tt-teats-soothers,Cherry Latex,,,2 pack,,soother,,18-36m,Unisex,latex cherry,,70,2026-05-01,
8464578383.0,active,TT NS BTL 260ML,Tommee Tippee Natural Start Bottle 260ml,Tommee Tippee,tt-bottles-pumps,,Natural Start,260ml,1 pack,,bottle,,,Unisex,natural start bottle,,70,2026-05-01,
4534318512.0,active,TT NS PP BTL 260ML DEC 2PK,Tommee Tippee Natural Start PP Bottle 260ml Decorated 2 Pack,Tommee Tippee,tt-bottles-pumps,Decorated,Natural Start,260ml,2 pack,,bottle,,,Unisex,decorated pp bottle,,70,2026-05-01,
8918818529.0,active,TT NS BTL 260ML 3PK,Tommee Tippee Natural Start Bottle 260ml 3 Pack,Tommee Tippee,tt-bottles-pumps,,Natural Start,260ml,3 pack,,bottle,,,Unisex,natural start 3 pack,,70,2026-05-01,
6158878390.0,active,TT NS PP BTL 340ML 2PK,Tommee Tippee Natural Start PP Bottle 340ml 2 Pack,Tommee Tippee,tt-bottles-pumps,,Natural Start,340ml,2 pack,,bottle,,,Unisex,pp bottle 340ml,,70,2026-05-01,
1149158406.0,active,TT NS PPSU BTL SLOW TEAT 150ML,Tommee Tippee Natural Start PPSU Bottle Slow Teat 150ml,Tommee Tippee,tt-bottles-pumps,Slow Teat,Natural Start,150ml,1 pack,,bottle,,,Unisex,ppsu slow teat,,70,2026-05-01,
8186498413.0,active,TT NS PPSU BTL SLOW TEAT 260ML,Tommee Tippee Natural Start PPSU Bottle Slow Teat 260ml,Tommee Tippee,tt-bottles-pumps,Slow Teat,Natural Start,260ml,1 pack,,bottle,,,Unisex,ppsu slow teat,,70,2026-05-01,
8781718734.0,active,TT NS GLASS BTL SLOW TEAT 250M,Tommee Tippee Natural Start Glass Bottle Slow Teat 250ml,Tommee Tippee,tt-bottles-pumps,Slow Teat,Natural Start,250ml,1 pack,,glass bottle,,,Unisex,glass bottle slow teat,,70,2026-05-01,
3581918444.0,active,TT NS SILICON BTL 260ML,Tommee Tippee Natural Start Silicone Bottle 260ml,Tommee Tippee,tt-bottles-pumps,,Natural Start,260ml,1 pack,,bottle,,,Unisex,silicone bottle,,70,2026-05-01,
6982198468.0,active,TT ADV A/C BTL 260ML,Tommee Tippee Advanced Anti-Colic Bottle 260ml,Tommee Tippee,tt-bottles-pumps,Anti-Colic,Advanced,260ml,1 pack,,bottle,,,Unisex,anti colic air vent,,70,2026-05-01,
4183148482.0,active,TT ADV A/C BTL 260ML 2PK,Tommee Tippee Advanced Anti-Colic Bottle 260ml 2 Pack,Tommee Tippee,tt-bottles-pumps,Anti-Colic,Advanced,260ml,2 pack,,bottle,,,Unisex,anti colic,,70,2026-05-01,
4707350126.0,active,TT HEALTHCARE KIT,Tommee Tippee Healthcare Kit,Tommee Tippee,tt-bottles-pumps,,,kit,1 pack,,kit,,,Unisex,healthcare kit,,70,2026-05-01,
9291912495.0,active,TT COLIC MILK AIR REMOVER,Tommee Tippee Colic Milk Air Remover,Tommee Tippee,tt-bottles-pumps,Colic,,,1 pack,,accessory,,,Unisex,colic air remover,,70,2026-05-01,
3406616449.0,active,TT M4M SING/SILIC BREAST PUMP,Tommee Tippee Made for Me Single Silicone Breast Pump,Tommee Tippee,tt-bottles-pumps,Single Silicone,Made for Me,,1 pack,,breast pump,,,Unisex,manual pump silicone,,70,2026-05-01,
6398182502.0,active,TT M4M MANUAL BREAST PUMP,Tommee Tippee Made for Me Manual Breast Pump,Tommee Tippee,tt-bottles-pumps,Manual,Made for Me,,1 pack,,breast pump,,,Unisex,manual breast pump,,70,2026-05-01,
6815122519.0,active,TT SNGL ELECT BREAST PUMP NEW,Tommee Tippee Single Electric Breast Pump,Tommee Tippee,tt-bottles-pumps,Single Electric,,,1 pack,,breast pump,,,Unisex,electric pump,,70,2026-05-01,
2144450349.0,active,TT C2N EXPRESS & GO PCHES 20P,Tommee Tippee Closer to Nature Express & Go Pouches 20 Pack,Tommee Tippee,tt-bottles-pumps,,Closer to Nature,20 pack,20 pack,,pouches,,,Unisex,express go pouches,,70,2026-05-01,
7479361016.0,active,XTT PERFECT PREP,Tommee Tippee Perfect Prep Machine,Tommee Tippee,tt-bottles-pumps,,Perfect Prep,,1 pack,,prep machine,,,Unisex,formula prep,,70,2026-05-01,
2752632090.0,active,TT C2N MICRW STEAM STERILISER,Tommee Tippee Closer to Nature Microwave Steam Steriliser,Tommee Tippee,tt-bottles-pumps,,Closer to Nature,,1 pack,,steriliser,,,Unisex,microwave steam,,70,2026-05-01,
2913282120.0,active,TT C2N POUCH & BTTL WARMER,Tommee Tippee Closer to Nature Pouch and Bottle Warmer,Tommee Tippee,tt-bottles-pumps,,Closer to Nature,,1 pack,,warmer,,,Unisex,bottle warmer pouch warmer,,70,2026-05-01,
2308810230.0,active,TT C2N PPR FILTER,Tommee Tippee Closer to Nature Perfect Prep Replacement Filter,Tommee Tippee,tt-bottles-pumps,,Closer to Nature,,1 pack,,filter,,,Unisex,replacement filter,,70,2026-05-01,
2757356156.0,active,AVENT BOTTLE/TEAT BRUSH,Avent Bottle and Teat Brush,Avent,avent-bottles,,,,1 pack,,brush,,,Unisex,bottle teat brush,,70,2026-05-01,
7588886941.0,active,AVENT POWDERED MILK DISPENSER,Avent Powdered Milk Dispenser,Avent,avent-cups-soothers,,,,1 pack,,dispenser,,,Unisex,powdered milk dispenser,,70,2026-05-01,
6183581488.0,active,AVENT TRAINER CUP 6M+ 125ML,Avent Trainer Cup 6m+ 125ml,Avent,avent-cups-soothers,Trainer,,125ml,1 pack,,cup,,6m+,Unisex,trainer cup,,70,2026-05-01,
9238030832.0,active,AVENT EASY SIP CUP 200ML,Avent Easy Sip Cup 200ml,Avent,avent-cups-soothers,Easy Sip,,200ml,1 pack,,cup,,,Unisex,easy sip,,70,2026-05-01,
9238051837.0,active,AVENT BENDY STRW CUP 200ML,Avent Bendy Straw Cup 200ml,Avent,avent-cups-soothers,Bendy Straw,,200ml,1 pack,,straw cup,,,Unisex,bendy straw,,70,2026-05-01,
9238076231.0,active,AVENT GRIPPY CUP SFT 300ML,Avent Grippy Cup Soft Spout 300ml,Avent,avent-cups-soothers,Grippy Soft,,300ml,1 pack,,cup,,,Unisex,soft spout,,70,2026-05-01,
9238086347.0,active,AVENT GRIPPY CUP HRD 300ML,Avent Grippy Cup Hard Spout 300ml,Avent,avent-cups-soothers,Grippy Hard,,300ml,1 pack,,cup,,,Unisex,hard spout,,70,2026-05-01,
9238061943.0,active,AVENT BENDY STRW CUP 300ML,Avent Bendy Straw Cup 300ml,Avent,avent-cups-soothers,Bendy Straw,,300ml,1 pack,,straw cup,,,Unisex,bendy straw,,70,2026-05-01,
1545002680.0,active,AVENT UA STHR 6-18M D/MIX 2PK,Avent Ultra Air Soother 6-18m Design Mix 2 Pack,Avent,avent-cups-soothers,Ultra Air,,,2 pack,,soother,,6-18m,Unisex,ultra air design mix,,70,2026-05-01,
6554452942.0,active,AVENT US STHR DEC 18+M 2PK,Avent Ultra Soft Soother Decor 18m+ 2 Pack,Avent,avent-cups-soothers,Ultra Soft Decor,,,2 pack,,soother,,18m+,Unisex,ultra soft decor,,70,2026-05-01,
6562736611.0,active,AVENT MICRO STERIL BAGS 5PK,Avent Microwave Sterilising Bags 5 Pack,Avent,avent-sterilisers-milton,,,5 pack,5 pack,,sterilising bags,,,Unisex,microwave sterilising bags,,70,2026-05-01,
9218677664.0,active,AVENT NIPPLE SHIELD SMALL,Avent Nipple Shield Small,Avent,avent-bottles,Small,,,1 pack,,nipple shield,,,Unisex,small nipple shield,,70,2026-05-01,
9218687756.0,active,AVENT NIPPLE SHIELD MEDIUM,Avent Nipple Shield Medium,Avent,avent-bottles,Medium,,,1 pack,,nipple shield,,,Unisex,medium nipple shield,,70,2026-05-01,
5364552997.0,active,AVENT UA STHR NIGHT 0-6M 2PK,Avent Ultra Air Night Soother 0-6m 2 Pack,Avent,avent-cups-soothers,Ultra Air Night,,,2 pack,,soother,,0-6m,Unisex,night soother,,70,2026-05-01,
5545642966.0,active,AVENT UA STHR NIGHT 6-18M 2PK,Avent Ultra Air Night Soother 6-18m 2 Pack,Avent,avent-cups-soothers,Ultra Air Night,,,2 pack,,soother,,6-18m,Unisex,night soother,,70,2026-05-01,
3485867473.0,active,AVENT UA STHR NIGHT 18+M 2PK,Avent Ultra Air Night Soother 18m+ 2 Pack,Avent,avent-cups-soothers,Ultra Air Night,,,2 pack,,soother,,18m+,Unisex,night soother,,70,2026-05-01,
9271171625.0,active,AVENT SOOTHIE 0-6M PINK 2PK,Avent Soothie 0-6m Pink 2 Pack,Avent,avent-cups-soothers,Pink,Soothie,,2 pack,Pink,soother,,0-6m,Unisex,pink soothie,,70,2026-05-01,
9271161618.0,active,AVENT SOOTHIE 0-6M BLUE 2PK,Avent Soothie 0-6m Blue 2 Pack,Avent,avent-cups-soothers,Blue,Soothie,,2 pack,Blue,soother,,0-6m,Unisex,blue soothie,,70,2026-05-01,
4611661525.0,active,AVENT NAT RES FB A/F 125 2P,Avent Natural Response Feeding Bottle 125ml 2 Pack,Avent,avent-bottles,Anti-colic AirFree,Natural Response,125ml,2 pack,,bottle,,,Unisex,natural response airfree,,70,2026-05-01,
5661801655.0,active,AVENT NAT RES PP BOTL 260ML,Avent Natural Response PP Bottle 260ml,Avent,avent-bottles,,Natural Response,260ml,1 pack,,bottle,,,Unisex,natural response,,70,2026-05-01,
8678621839.0,active,AVENT NAT RES FEED BOTL 330 1P,Avent Natural Response Feeding Bottle 330ml,Avent,avent-bottles,,Natural Response,330ml,1 pack,,bottle,,,Unisex,natural response,,70,2026-05-01,
8353461631.0,active,AVENT NAT RES FEED BOTL 125 2P,Avent Natural Response Feeding Bottle 125ml 2 Pack,Avent,avent-bottles,,Natural Response,125ml,2 pack,,bottle,,,Unisex,natural response,,70,2026-05-01,
1221841679.0,active,AVENT NAT RES FEED BOTL 260 2P,Avent Natural Response Feeding Bottle 260ml 2 Pack,Avent,avent-bottles,,Natural Response,260ml,2 pack,,bottle,,,Unisex,natural response,,70,2026-05-01,
7627011983.0,active,AVENT NAT RES BOTL 330ML 2PK,Avent Natural Response Bottle 330ml 2 Pack,Avent,avent-bottles,,Natural Response,330ml,2 pack,,bottle,,,Unisex,natural response,,70,2026-05-01,
7785369904.0,active,AVT ANCL BTTL 260ML 2PK,Avent Anti-Colic Bottle 260ml 2 Pack,Avent,avent-bottles,Anti-Colic,,260ml,2 pack,,bottle,,,Unisex,anti colic,,70,2026-05-01,
6652661419.0,active,AVENT NAT RES B/BOTL START SET,Avent Natural Response Baby Bottle Starter Set,Avent,avent-bottles,,Natural Response,,set,,bottle set,,,Unisex,starter set,,70,2026-05-01,
4636836209.0,active,AVENT SINGLE ELEC BREAST PUMP,Avent Single Electric Breast Pump,Avent,avent-sterilisers-milton,Single Electric,,,1 pack,,breast pump,,,Unisex,electric breast pump,,70,2026-05-01,
7946287530.0,active,AVENT MICROWAVE STEAM STR SET,Avent Microwave Steam Steriliser Set,Avent,avent-sterilisers-milton,,,set,1 pack,,steriliser,,,Unisex,microwave steriliser,,70,2026-05-01,
6993079810.0,active,AVENT 3 IN1 ELEC STEAM STERIL,Avent 3 in 1 Electric Steam Steriliser,Avent,avent-sterilisers-milton,3 in 1,,,1 pack,,steriliser,,,Unisex,electric steriliser,,70,2026-05-01,
3132880287.0,active,MILTON ANTI/B ACT SLTN 500ML,Milton Antibacterial Solution 500ml,Milton,avent-sterilisers-milton,,,500ml,1 pack,,solution,,,Unisex,antibacterial solution,,70,2026-05-01,
2593903956.0,active,MILTON BABY BOTTLE CLEANER 500ML,Milton Baby Bottle Cleaner 500ml,Milton,avent-sterilisers-milton,,,500ml,1 pack,,cleaner,,,Unisex,bottle cleaner,,70,2026-05-01,
2593583799.0,active,MILTON ANTI/B S/SPRAY 500ML,Milton Antibacterial Spray 500ml,Milton,avent-sterilisers-milton,,,500ml,1 pack,,spray,,,Unisex,antibacterial spray,,70,2026-05-01,
7299211596.0,active,AVENT VIA BREASTMILK CONTAINR,Avent VIA Breastmilk Container,Avent,avent-sterilisers-milton,,VIA,,1 pack,,container,,,Unisex,breastmilk container,,70,2026-05-01,
6022272106.0,active,AVENT ELECTRIC BOTTLE WARMER,Avent Electric Bottle Warmer,Avent,avent-sterilisers-milton,,,,1 pack,,warmer,,,Unisex,electric bottle warmer,,70,2026-05-01,
8447082409.0,active,NUK FIRST CHOICE 18 FLOW TEAT,NUK First Choice Flow Teat,NUK,nuk-medela-top,,First Choice,,2 pack,,teat,,,Unisex,flow teat,,70,2026-05-01,
6603602751.0,active,NUK/MM TEMP CONT 6-18M 150ML,NUK/Mickey Mouse Temperature Control Bottle 6-18m 150ml,NUK,nuk-medela-top,Mickey Mouse,Temperature Control,150ml,1 pack,,bottle,,6-18m,Unisex,temperature control,,70,2026-05-01,
3387230104.0,active,MEDELA BREAST MILK BAGS 25PK,Medela Breast Milk Bags 25 Pack,Medela,nuk-medela-top,,,25 pack,25 pack,,storage bags,,,Unisex,milk bags,,70,2026-05-01,
8707860135.0,active,MEDELA BREASTMILK BAGS 50PK,Medela Breast Milk Bags 50 Pack,Medela,nuk-medela-top,,,50 pack,50 pack,,storage bags,,,Unisex,milk bags,,70,2026-05-01,
9696500573.0,active,MEDELA VALVE/MEMBRANE PACK,Medela Valve and Membrane Pack,Medela,nuk-medela-top,,,,2 pack,,accessory,,,Unisex,valve membrane,,70,2026-05-01,
9990722470.0,active,PIGEON M/LIGHT PACIFIER 2PK S,Pigeon Mini Light Pacifier Small 2 Pack,Pigeon,pigeon-medela-mid,Small,Mini Light,,2 pack,,pacifier,,,Unisex,small dummy,,70,2026-05-01,
9922062487.0,active,PIGEON M/LIGHT PACIFIER 2PK M,Pigeon Mini Light Pacifier Medium 2 Pack,Pigeon,pigeon-medela-mid,Medium,Mini Light,,2 pack,,pacifier,,,Unisex,medium dummy,,70,2026-05-01,
4817962494.0,active,PIGEON M/LIGHT PACIFIER 2PK L,Pigeon Mini Light Pacifier Large 2 Pack,Pigeon,pigeon-medela-mid,Large,Mini Light,,2 pack,,pacifier,,,Unisex,large dummy,,70,2026-05-01,
7516536021.0,active,MEDELA P/F FLEX B/SHLD SML 21,Medela PersonalFit Flex Breast Shield Small 21mm,Medela,nuk-medela-top,Small,PersonalFit Flex,21mm,1 pack,,breast shield,,,Unisex,21mm shield,,70,2026-05-01,
7516546076.0,active,MEDELA P/F FLEX B/SHLD MED 24,Medela PersonalFit Flex Breast Shield Medium 24mm,Medela,nuk-medela-top,Medium,PersonalFit Flex,24mm,1 pack,,breast shield,,,Unisex,24mm shield,,70,2026-05-01,
7516556120.0,active,MEDELA P/F FLEX B/SHLD LGE 27,Medela PersonalFit Flex Breast Shield Large 27mm,Medela,nuk-medela-top,Large,PersonalFit Flex,27mm,1 pack,,breast shield,,,Unisex,27mm shield,,70,2026-05-01,
7516566175.0,active,MEDELA P/F FLEX B/SHLD E/LG 30,Medela PersonalFit Flex Breast Shield Extra Large 30mm,Medela,nuk-medela-top,Extra Large,PersonalFit Flex,30mm,1 pack,,breast shield,,,Unisex,30mm shield,,70,2026-05-01,
7038985506.0,active,PIGEON 2IN1 NYLN BTL TEAT BSH,Pigeon 2 in 1 Nylon Bottle and Teat Brush,Pigeon,pigeon-medela-mid,,,,1 pack,,brush,,,Unisex,bottle teat brush,,70,2026-05-01,
9257550667.0,active,MEDELA CONTACT NIP SHIELD SML,Medela Contact Nipple Shield Small,Medela,nuk-medela-top,Small,Contact,,1 pack,,nipple shield,,,Unisex,small contact shield,,70,2026-05-01,
9257626612.0,active,MEDELA CONTACT NIP SHIELD MED,Medela Contact Nipple Shield Medium,Medela,nuk-medela-top,Medium,Contact,,1 pack,,nipple shield,,,Unisex,medium contact shield,,70,2026-05-01,
9257541671.0,active,MEDELA CONTACT NIP SHIELD LGE,Medela Contact Nipple Shield Large,Medela,nuk-medela-top,Large,Contact,,1 pack,,nipple shield,,,Unisex,large contact shield,,70,2026-05-01,
9766283537.0,active,MEDELA BM CO SHELLS 2PK,Medela Breast Milk Collection Shells 2 Pack,Medela,pigeon-medela-mid,,,,2 pack,,collection shells,,,Unisex,milk collection shells,,70,2026-05-01,
5639952924.0,active,PIGEON S/TOUCH G3 BOT PP 160X2,Pigeon SoftTouch G3 PP Bottle 160ml 2 Pack,Pigeon,pigeon-medela-mid,,SoftTouch G3,160ml,2 pack,,bottle,,,Unisex,pp bottle,,70,2026-05-01,
1491812931.0,active,PIGEON S/TOUCH G3 BOT PP 240X2,Pigeon SoftTouch G3 PP Bottle 240ml 2 Pack,Pigeon,pigeon-medela-mid,,SoftTouch G3,240ml,2 pack,,bottle,,,Unisex,pp bottle,,70,2026-05-01,
9386377244.0,active,MEDELA QUIK CLN M/WAV BAGS 5PK,Medela Quick Clean Microwave Bags 5 Pack,Medela,pigeon-medela-mid,,Quick Clean,5 pack,5 pack,,sterilising bags,,,Unisex,microwave bags,,70,2026-05-01,
1531432719.0,active,PIGEON S/TOUCH GLASS BOT 160,Pigeon SoftTouch Glass Bottle 160ml,Pigeon,pigeon-medela-bottom,,SoftTouch,160ml,1 pack,,glass bottle,,,Unisex,glass bottle,,70,2026-05-01,
5685852726.0,active,PIGEON S/TOUCH GLASS BOT 240,Pigeon SoftTouch Glass Bottle 240ml,Pigeon,pigeon-medela-bottom,,SoftTouch,240ml,1 pack,,glass bottle,,,Unisex,glass bottle,,70,2026-05-01,
9260493216.0,active,PIGEON B/MILK STRGE BAGS 25,Pigeon Breastmilk Storage Bags 25 Pack,Pigeon,pigeon-medela-bottom,,,25 pack,25 pack,,storage bags,,,Unisex,milk storage bags,,70,2026-05-01,
5386636530.0,active,MEDELA HANDSF COLLECTOR CUPS,Medela Hands-free Collection Cups,Medela,pigeon-medela-bottom,Hands-free,,,1 pack,,collection cups,,,Unisex,handsfree collector,,70,2026-05-01,
1336321193.0,active,WELCARE ELEC BR/P USB C,Welcare Electric Breast Pump USB C,Welcare,pigeon-medela-bottom,USB C,,,1 pack,,breast pump,,,Unisex,electric usb pump,,70,2026-05-01,
6189931360.0,active,WELCARE S/DRY WLESS BED ALARM,Welcare Stay Dry Wireless Bed Alarm,Welcare,pigeon-medela-bottom,Wireless,Stay Dry,,1 pack,,bed alarm,,,Unisex,bed wetting alarm,,70,2026-05-01,
9216829148.0,active,PIGEON MILK SAVER PUMP 110ML,Pigeon Milk Saver Pump 110ml,Pigeon,pigeon-medela-bottom,,,110ml,1 pack,,breast pump,,,Unisex,milk saver,,70,2026-05-01,
5560618167.0,active,PIGEON GOMINI PLUS ELEC BRST/P,Pigeon GoMini Plus Electric Breast Pump,Pigeon,pigeon-medela-bottom,GoMini Plus,,,1 pack,,breast pump,,,Unisex,electric pump,,70,2026-05-01,
9209853448.0,active,MEDELA HARMONY MANUAL B/PUMP,Medela Harmony Manual Breast Pump,Medela,pigeon-medela-bottom,Manual,Harmony,,1 pack,,breast pump,,,Unisex,manual pump,,70,2026-05-01,
4311198442.0,active,MEDELA SOLO H/FREE SGL ELEC BP,Medela Solo Hands-free Single Electric Breast Pump,Medela,pigeon-medela-bottom,Single Electric,Solo Hands-free,,1 pack,,breast pump,,,Unisex,handsfree single,,70,2026-05-01,
8638647995.0,active,MEDELA SWING/MAX H/FREE D/E/BP,Medela Swing Maxi Hands-free Double Electric Breast Pump,Medela,pigeon-medela-bottom,Double Electric,Swing Maxi Hands-free,,1 pack,,breast pump,,,Unisex,double pump,,70,2026-05-01,
7806439848.0,active,PIGEON BTL LIQ CLNSE 450ML,Pigeon Bottle Liquid Cleanser 450ml,Pigeon,pigeon-medela-bottom,,,450ml,1 pack,,cleanser,,,Unisex,liquid cleanser,,70,2026-05-01,
2709429855.0,active,PIGEON BTTL LIQ CLNSE 700ML,Pigeon Bottle Liquid Cleanser 700ml,Pigeon,pigeon-medela-bottom,,,700ml,1 pack,,cleanser,,,Unisex,liquid cleanser,,70,2026-05-01,
2756279794.0,active,PIGEON LIQUID CLN REFILL 650ML,Pigeon Liquid Cleanser Refill 650ml,Pigeon,pigeon-medela-bottom,,,650ml,1 pack,,refill,,,Unisex,cleanser refill,,70,2026-05-01,
3523656827.0,active,NUK BABY/BTL CLN 500ML,NUK Baby Bottle Cleanser 500ml,NUK,pigeon-medela-bottom,,,500ml,1 pack,,cleanser,,,Unisex,bottle cleanser,,70,2026-05-01,
2693740670.0,active,MILTON ANTIBAC SOLUBLE WIPE 30PK,Milton Antibacterial Soluble Wipes 30 Pack,Milton,pigeon-medela-bottom,,,30 pack,30 pack,,wipes,,,Unisex,antibacterial wipes,,70,2026-05-01,
9291952022.0,active,NUK MICKEY/M SOOTH 0-6M 2PK,NUK Mickey Mouse Soother 0-6m 2 Pack,NUK,nuk-soothers-bottles,Mickey Mouse,,,2 pack,,soother,,0-6m,Unisex,mickey mouse,,70,2026-05-01,
9291962016.0,active,NUK MICKEY/M SOOTH 6-18M 2PK,NUK Mickey Mouse Soother 6-18m 2 Pack,NUK,nuk-soothers-bottles,Mickey Mouse,,,2 pack,,soother,,6-18m,Unisex,mickey mouse,,70,2026-05-01,
2223532008.0,active,NUK MICKEY/M SOOTH S 2PK,NUK Mickey Mouse Soother Small 2 Pack,NUK,nuk-soothers-bottles,Small Mickey Mouse,,,2 pack,,soother,,,Unisex,mickey mouse,,70,2026-05-01,
4876680061.0,active,NUK SIG SOOTH SILIC 0-6 2PK,NUK Signature Silicone Soother 0-6m 2 Pack,NUK,nuk-soothers-bottles,Signature Silicone,,,2 pack,,soother,,0-6m,Unisex,signature silicone,,70,2026-05-01,
6970440030.0,active,NUK SIG SOOTH SILIC 6-18 2PK,NUK Signature Silicone Soother 6-18m 2 Pack,NUK,nuk-soothers-bottles,Signature Silicone,,,2 pack,,soother,,6-18m,Unisex,signature silicone,,70,2026-05-01,
9291940054.0,active,NUK SIG SOOTH SILIC 18-36 2PK,NUK Signature Silicone Soother 18-36m 2 Pack,NUK,nuk-soothers-bottles,Signature Silicone,,,2 pack,,soother,,18-36m,Unisex,signature silicone,,70,2026-05-01,
9291990032.0,active,NUK FIRST PP C BOT 150ML 0-6M,NUK First Choice PP Bottle 150ml 0-6m,NUK,nuk-soothers-bottles,,First Choice,150ml,1 pack,,bottle,,0-6m,Unisex,first choice bottle,,70,2026-05-01,
9291982362.0,active,NUK FIRST C/GL BOT 240 0-6M,NUK First Choice Glass Bottle 240ml 0-6m,NUK,nuk-soothers-bottles,,First Choice,240ml,1 pack,,glass bottle,,0-6m,Unisex,glass bottle,,70,2026-05-01,
9280352635.0,active,B.BOX WRIST TEETHER B/FOX,B.Box Wrist Teether Blue Fox,B.Box,bbox-cups-top,Blue Fox,,,1 pack,Blue Fox,teether,,,Unisex,wrist teether,,70,2026-05-01,
9280372611.0,active,B.BOX WRIST TEETHER P/FOX,B.Box Wrist Teether Pink Fox,B.Box,bbox-cups-top,Pink Fox,,,1 pack,Pink Fox,teether,,,Unisex,wrist teether,,70,2026-05-01,
9280362604.0,active,B.BOX WRIST TEETHER WLF/LULLABY,B.Box Wrist Teether Wolf Lullaby,B.Box,bbox-cups-top,Wolf Lullaby,,,1 pack,,teether,,,Unisex,wrist teether,,70,2026-05-01,
9280382628.0,active,B.BOX WRIST TEETHER S/FOX,B.Box Wrist Teether Sage Fox,B.Box,bbox-cups-top,Sage Fox,,,1 pack,,teether,,,Unisex,wrist teether,,70,2026-05-01,
3026333970.0,active,B.BOX SILIC REPLACE POUCH 2PK,B.Box Silicone Replacement Pouch 2 Pack,B.Box,bbox-cups-top,,,2 pack,2 pack,,pouch,,,Unisex,replacement pouch,,70,2026-05-01,
7510314097.0,active,B.BOX SPOUT CUP OCEAN,B.Box Spout Cup Ocean,B.Box,bbox-cups-top,Ocean,,,1 pack,Ocean,spout cup,,,Unisex,spout cup,,70,2026-05-01,
7510324141.0,active,B.BOX SPOUT CUP BLUSH,B.Box Spout Cup Blush,B.Box,bbox-cups-top,Blush,,,1 pack,Blush,spout cup,,,Unisex,spout cup,,70,2026-05-01,
7457705018.0,active,B.BOX SIPPY CUP BLUE/B 240ML,B.Box Sippy Cup Blue 240ml,B.Box,bbox-cups-top,Blue,,240ml,1 pack,Blue,sippy cup,,,Unisex,sippy cup,,70,2026-05-01,
7457715025.0,active,B.BOX SIPPY CUP RASP/B 240ML,B.Box Sippy Cup Raspberry 240ml,B.Box,bbox-cups-top,Raspberry,,240ml,1 pack,Raspberry,sippy cup,,,Unisex,sippy cup,,70,2026-05-01,
7457725032.0,active,B.BOX SIPPY CUP APPLE 240ML,B.Box Sippy Cup Apple 240ml,B.Box,bbox-cups-top,Apple,,240ml,1 pack,Apple,sippy cup,,,Unisex,sippy cup,,70,2026-05-01,
7457805131.0,active,B.BOX SIPPY CUP AQUA 240ML,B.Box Sippy Cup Aqua 240ml,B.Box,bbox-cups-top,Aqua,,240ml,1 pack,Aqua,sippy cup,,,Unisex,sippy cup,,70,2026-05-01,
2622027357.0,active,B.BOX SILIC FSH FOOD/F BLUSH,B.Box Silicone Fresh Food Feeder Blush,B.Box,bbox-cups-top,Blush,,,1 pack,Blush,food feeder,,,Unisex,fresh food feeder,,70,2026-05-01,
9280310579.0,active,B.BOX 360 CUP EMER FOR 250ML,B.Box 360 Cup Emerald Forest 250ml,B.Box,bbox-cups-top,Emerald Forest,360,250ml,1 pack,,cup,,,Unisex,360 cup,,70,2026-05-01,
9280320562.0,active,B.BOX 360 CUP LILAC POP 250ML,B.Box 360 Cup Lilac Pop 250ml,B.Box,bbox-cups-top,Lilac Pop,360,250ml,1 pack,,cup,,,Unisex,360 cup,,70,2026-05-01,
9843520098.0,active,B.BOX SIPPY CUP DIS MICKEY 240,B.Box Disney Mickey Sippy Cup 240ml,B.Box,bbox-cups-top,Mickey,Disney,240ml,1 pack,,sippy cup,,,Unisex,mickey,,70,2026-05-01,
