productId,status,title,displayName,brand,groupId,variant,series,size,packSize,flavour,format,strength,ageRange,gender,keywordsExtra,imageUrl,priority,lastUpdated,notes
9231134533.0,active,SORBENT FACIAL/TISS NAT 80PK 2,Sorbent Natural Facial Tissues 80 Pack,Sorbent,facial-tissues,Natural,,80 pack,80 pack,,tissue,,,Unisex,natural tissues,,70,2026-05-02,
9216573177.0,active,KLEENEX EVERYDAY KIDS 200PK 1,Kleenex Everyday Kids Tissues 200 Pack,Kleenex,facial-tissues,Kids,Everyday,200 pack,200 pack,,tissue,,Kids,Unisex,kids tissues,,75,2026-05-02,
9269225935.0,active,KLEENEX SOFT AND THICK 120PK 1,Kleenex Soft and Thick Tissues 120 Pack,Kleenex,facial-tissues,Soft and Thick,,120 pack,120 pack,,tissue,,,Unisex,soft thick tissues,,75,2026-05-02,
372591274.0,active,WET ONES 15 BE FRESH TRAV PK 1,Wet Ones Be Fresh Travel Pack 15,Wet Ones,household-wipes,Be Fresh Travel,,15 wipes,15 pack,,wipes,,,Unisex,travel wipes,,70,2026-05-02,
1074660276.0,active,WET ONES BE FRESH 80 1,Wet Ones Be Fresh Wipes 80,Wet Ones,household-wipes,Be Fresh,,80 wipes,80 pack,,wipes,,,Unisex,be fresh wipes,,70,2026-05-02,
369131311.0,active,WET ONES BE GENTLE 40 1,Wet Ones Be Gentle Wipes 40,Wet Ones,household-wipes,Be Gentle,,40 wipes,40 pack,,wipes,,,Unisex,gentle wipes,,70,2026-05-02,
9377681358.0,active,WET ONES BE GENTLE SENS 120 VP 1,Wet Ones Be Gentle Sensitive Wipes 120,Wet Ones,household-wipes,Sensitive,Be Gentle,120 wipes,120 pack,,wipes,,,Unisex,sensitive wipes,,70,2026-05-02,
8820925271.0,active,KLEENEX WIPES ANTI/B 1,Kleenex Antibacterial Wipes,Kleenex,household-wipes,Antibacterial,,,,,wipes,,,Unisex,antibacterial wipes,,70,2026-05-02,
9228883375.0,active,KLEENEX A/BACT WIPES 40 PACK 1,Kleenex Antibacterial Wipes 40 Pack,Kleenex,household-wipes,Antibacterial,,40 wipes,40 pack,,wipes,,,Unisex,anti bacterial wipes,,70,2026-05-02,
9212709620.0,active,SORBENT FLUSH WIPES HYPO/A 40 1,Sorbent Flushable Wipes Hypoallergenic 40,Sorbent,household-wipes,Hypoallergenic Flushable,,40 wipes,40 pack,,wipes,,,Unisex,flushable hypoallergenic wipes,,70,2026-05-02,
2409869613.0,active,SORBENT FLUSHABLE WIPES 40PK 1,Sorbent Flushable Wipes 40 Pack,Sorbent,household-wipes,Flushable,,40 wipes,40 pack,,wipes,,,Unisex,flushable wipes,,70,2026-05-02,
2585988497.0,active,SORBENT T/P LUXE L/S WHT 8PK 1,Sorbent Toilet Paper Luxe Long Sheet White 8 Pack,Sorbent,toilet-paper,Luxe Long Sheet White,,8 pack,8 pack,,toilet paper,,,Unisex,"luxe, long sheet",,80,2026-05-02,
3446832208.0,active,SORBENT T/P SILKY WHT/L 8PK 1,Sorbent Toilet Paper Silky White 8 Pack,Sorbent,toilet-paper,Silky White,,8 pack,8 pack,,toilet paper,,,Unisex,silky white,,80,2026-05-02,
8845894808.0,active,PUREX T/T MEGA/L WHITE 6PK NEW 1,Purex Toilet Tissue Mega Long White 6 Pack,Purex,toilet-paper,Mega Long White,,6 pack,6 pack,,toilet paper,,,Unisex,mega long white,,80,2026-05-02,
1054866667.0,active,KLEENEX VIVA PAPER TOWEL 2PK 1,Kleenex Viva Paper Towel 2 Pack,Kleenex Viva,paper-towels,,Viva,2 pack,2 pack,,paper towel,,,Unisex,viva paper towel,,80,2026-05-02,
,active,HANDEE ULTRA TOWEL WHITE 2PK 1,Handee Ultra Paper Towel White 2 Pack,Handee,paper-towels,Ultra White,,2 pack,2 pack,,paper towel,,,Unisex,ultra towel,,80,2026-05-02,product code not visible in image
,active,5584 HANDEE PAP TOWEL D/L 2 ROLLS 1,Handee Paper Towel Double Length 2 Rolls,Handee,paper-towels,Double Length,,2 rolls,2 rolls,,paper towel,,,Unisex,double length,,80,2026-05-02,only partial code visible
6735038852.0,active,FINISH PWR D/W TAB,Finish Power Dishwasher Tablets,Finish,dishwashing,Power,,,,,dishwasher tablet,,,Unisex,dishwasher tablets,,85,2026-05-02,
9742114689.0,active,FINISH DWASHER D/CLNR LM 250,Finish Dishwasher Cleaner Lemon 250ml,Finish,dishwashing,Dishwasher Cleaner,,250ml,,Lemon,liquid,,,Unisex,dishwasher cleaner,,80,2026-05-02,
5866858821.0,active,FINISH PWR D/W TAB LEMON 76 1,Finish Power Dishwasher Tablets Lemon 76,Finish,dishwashing,Power,,76 tablets,76 tablets,Lemon,tablet,,,Unisex,lemon dishwasher tablets,,85,2026-05-02,
8866671806.0,active,FINISH PWR D/W TAB LEMON 110 1,Finish Power Dishwasher Tablets Lemon 110,Finish,dishwashing,Power,,110 tablets,110 tablets,Lemon,tablet,,,Unisex,lemon dishwasher tablets,,85,2026-05-02,
3403706591.0,active,FINISH QUANT D/W TAB LEMON 90 1,Finish Quantum Dishwasher Tablets Lemon 90,Finish,dishwashing,Lemon,Quantum,90 tablets,90 tablets,Lemon,tablet,,,Unisex,quantum lemon tablets,,85,2026-05-02,
7031898593.0,active,PALM DS/W LIQ LEMON/LIME 500ML 1,Palmolive Dishwashing Liquid Lemon Lime 500ml,Palmolive,dishwashing,Lemon Lime,,500ml,,Lemon Lime,liquid,,,Unisex,dish liquid,,80,2026-05-02,
9235901706.0,active,PALMOLIVE DISHWASH ANTB 1.3L 1,Palmolive Dishwash Antibacterial 1.3L,Palmolive,dishwashing,Antibacterial,,1.3L,,,liquid,,,Unisex,antibacterial dishwash,,80,2026-05-02,
9219472902.0,active,PALMOLIVE DISHWASH ORG 1.3L 1,Palmolive Dishwash Original 1.3L,Palmolive,dishwashing,Original,,1.3L,,Original,liquid,,,Unisex,original dishwash,,80,2026-05-02,
7903778423.0,active,EARTHWISE DISH/W LMN 30T NEW 1,Earthwise Dishwash Lemon 30 Tablets,Earthwise,dishwashing,Lemon,,30 tablets,30 tablets,Lemon,tablet,,,Unisex,dishwasher tabs,,80,2026-05-02,
1880837303.0,active,EARTHWISE DISH/LIQ LEMON 900 1,Earthwise Dish Liquid Lemon 900ml,Earthwise,dishwashing,Lemon,,900ml,,Lemon,liquid,,,Unisex,dish liquid,,80,2026-05-02,
9250050945.0,active,AJAX PROF BATH PWD TRIG 500ML 1,Ajax Professional Bathroom Powder Trigger 500ml,Ajax,multipurpose-cleaners,Bathroom Powder,,500ml,,,spray,,,Unisex,bathroom spray,,75,2026-05-02,
9223636584.0,active,DETTOL H/C BATHROOM SPRAY 500 1,Dettol Healthy Clean Bathroom Spray 500ml,Dettol,multipurpose-cleaners,Bathroom,,500ml,,,spray,,,Unisex,bathroom spray,,80,2026-05-02,
7039360800.0,active,MR MUSCLE BATH LIN 500M 1,Mr Muscle Bathroom Lime 500ml,Mr Muscle,multipurpose-cleaners,Bathroom Lime,,500ml,,Lime,spray,,,Unisex,bathroom cleaner,,75,2026-05-02,
7031930252.0,active,AJAX S&W KCB S/C TRIG 500ML 1,Ajax Spray and Wipe Kitchen Citrus Burst 500ml,Ajax,multipurpose-cleaners,Kitchen Citrus Burst,,500ml,,Citrus,spray,,,Unisex,spray wipe kitchen,,75,2026-05-02,
7039350817.0,active,MR MUSCLE IONIC KIT LEM 500ML 1,Mr Muscle Kitchen Lemon 500ml,Mr Muscle,multipurpose-cleaners,Kitchen Lemon,,500ml,,Lemon,spray,,,Unisex,kitchen spray,,75,2026-05-02,
9872213031.0,active,ECOSTORE DISHW TABS FF 30PK 1,Ecostore Dishwasher Tablets Fragrance Free 30 Pack,Ecostore,dishwashing,Fragrance Free,,30 pack,30 pack,,tablet,,,Unisex,fragrance free dishwasher tablets,,80,2026-05-02,
9644511128.0,active,ECOSTORE DISH/LIQ ULT SENS 1L 1,Ecostore Dish Liquid Ultra Sensitive 1L,Ecostore,dishwashing,Ultra Sensitive,,1L,,,liquid,,,Unisex,sensitive dish liquid,,80,2026-05-02,
1951320115.0,active,EARTH/C DISH/W LIQ 1LT 1,Earth Choice Dishwashing Liquid 1L,Earth Choice,dishwashing,,,1L,,,liquid,,,Unisex,dish liquid,,70,2026-05-02,
7039332025.0,active,MR MUSCLE GLASS CLN TRIG 500M 1,Mr Muscle Glass Cleaner Trigger 500ml,Mr Muscle,multipurpose-cleaners,Glass,,500ml,,,spray,,,Unisex,glass cleaner,,75,2026-05-02,
7031955158.0,active,AJAX SPRY GLASS TRIG 500ML 1,Ajax Spray Glass Trigger 500ml,Ajax,multipurpose-cleaners,Glass,,500ml,,,spray,,,Unisex,glass cleaner,,75,2026-05-02,
2104.0,active,DETTOL HLTY CLN MP CP AP 750ML 1,Dettol Healthy Clean Multi Purpose Cleaner 750ml,Dettol,multipurpose-cleaners,Multi Purpose,,750ml,,,spray,,,Unisex,multi purpose cleaner,,80,2026-05-02,product code incomplete in image
9880396941.0,active,GOAT A/BACT SURF SPR 500ML 1,Goat Antibacterial Surface Spray 500ml,Goat,multipurpose-cleaners,Antibacterial Surface,,500ml,,,spray,,,Unisex,antibacterial surface spray,,75,2026-05-02,
9249687635.0,active,XDETTOL TRU CLN MP TR 500ML 1,Dettol Tru Clean Multi Purpose Trigger 500ml,Dettol,multipurpose-cleaners,Tru Clean Multi Purpose,,500ml,,,spray,,,Unisex,true clean multipurpose,,80,2026-05-02,
9289504094.0,active,XDETTOL PROT 24 M/P CL TRIG C/B 1,Dettol Protect 24 Multi Purpose Cleaner Citrus Burst,Dettol,multipurpose-cleaners,Protect 24 Citrus Burst,,,,Citrus Burst,spray,,,Unisex,protect 24,,80,2026-05-02,
7036107236.0,active,MR MUSCLE M/P CLNR LM 500ML 1,Mr Muscle Multi Purpose Cleaner Lemon 500ml,Mr Muscle,multipurpose-cleaners,Lemon,,500ml,,Lemon,spray,,,Unisex,multi purpose lemon,,75,2026-05-02,
1250126509.0,active,EXIT MOULD TRIGGER 500ML 1,Exit Mould Trigger 500ml,Exit Mould,bathroom-cleaners,Mould Remover,,500ml,,,spray,,,Unisex,mould remover,,80,2026-05-02,
9250048805.0,active,AJAX SPRY M/P VN BRY TRG 475 1,Ajax Spray Multi Purpose Vanilla Berry Trigger 475ml,Ajax,multipurpose-cleaners,Vanilla Berry,,475ml,,Vanilla Berry,spray,,,Unisex,vanilla berry spray,,75,2026-05-02,
7031944137.0,active,AJAX SPRY LAV CITRS TRIG 500ML 1,Ajax Spray Lavender Citrus Trigger 500ml,Ajax,multipurpose-cleaners,Lavender Citrus,,500ml,,Lavender Citrus,spray,,,Unisex,lavender citrus spray,,75,2026-05-02,
9515335167.0,active,XEART H/C MULTI PURPOSE 600ML 1,Earthwise Healthy Clean Multi Purpose 600ml,Earthwise,multipurpose-cleaners,Multi Purpose,,600ml,,,spray,,,Unisex,multi purpose,,70,2026-05-02,
9832590238.0,active,ECOSTORE MULTIPURP A/B CITRS 500 1,Ecostore Multipurpose Antibacterial Citrus 500ml,Ecostore,multipurpose-cleaners,Antibacterial Citrus,,500ml,,Citrus,spray,,,Unisex,antibacterial citrus,,80,2026-05-02,
9250312620.0,active,ECOS/SEN M/PUR CLN 500ML 1,Ecostore Sensitive Multi Purpose Cleaner 500ml,Ecostore,multipurpose-cleaners,Sensitive,,500ml,,,spray,,,Unisex,sensitive multipurpose,,80,2026-05-02,
3055761616.0,active,ECOSTORE FLOOR & A/P CLEANER 51,Ecostore Floor and All Purpose Cleaner,Ecostore,floor-cleaners,Floor and All Purpose,,,,,liquid,,,Unisex,floor all purpose,,75,2026-05-02,
9663591656.0,active,ECOSTORE A/B MPUR REFILL 100ML 1,Ecostore Antibacterial Multi Purpose Refill 100ml,Ecostore,multipurpose-cleaners,Antibacterial Refill,,100ml,,,refill,,,Unisex,refill,,70,2026-05-02,
6831651562.0,active,ECOSTORE DISHCLEAN REFILL CON 1,Ecostore Dish Cleaner Refill Concentrate,Ecostore,dishwashing,Refill Concentrate,,,,,refill,,,Unisex,concentrate refill,,70,2026-05-02,
9249910001.0,active,EARTHWISE M/PURP SPR CIT 500ML 1,Earthwise Multipurpose Spray Citrus 500ml,Earthwise,multipurpose-cleaners,Citrus,,500ml,,Citrus,spray,,,Unisex,citrus multipurpose,,75,2026-05-02,
,active,PREM BLEACH LEM 2.5L 2,Premium Bleach Lemon 2.5L,Premium,bathroom-cleaners,Lemon,,2.5L,,Lemon,liquid,,,Unisex,bleach,,75,2026-05-02,product code not visible in image
,active,JANOLA B/R BLEACH GEL 750ML 2,Janola Bathroom Bleach Gel 750ml,Janola,bathroom-cleaners,Bathroom Bleach Gel,,750ml,,,gel,,,Unisex,bleach gel,,80,2026-05-02,product code not visible in image
9216690805.0,active,JANOLA B/R BLCH SPRY LEM 500ML 2,Janola Bathroom Bleach Spray Lemon 500ml,Janola,bathroom-cleaners,Lemon Bathroom Bleach,,500ml,,Lemon,spray,,,Unisex,bleach spray,,80,2026-05-02,
9216713776.0,active,JANOLA MOULD SCUM REM 500ML 2,Janola Mould and Scum Remover 500ml,Janola,bathroom-cleaners,Mould Scum Remover,,500ml,,,spray,,,Unisex,mould scum remover,,80,2026-05-02,
9228561458.0,active,FINISH D/WASHING PWD LEM S 2KG 1,Finish Dishwashing Powder Lemon 2kg,Finish,dishwashing,Lemon,,2kg,,Lemon,powder,,,Unisex,dishwashing powder,,80,2026-05-02,
9216095325.0,active,JIF CREAM LEMON 500ML 2,Jif Cream Lemon 500ml,Jif,bathroom-cleaners,Lemon Cream,,500ml,,Lemon,cream,,,Unisex,cream cleaner,,75,2026-05-02,
9216105332.0,active,JIF CREAM REGULAR 500ML 2,Jif Cream Regular 500ml,Jif,bathroom-cleaners,Regular Cream,,500ml,,,cream,,,Unisex,cream cleaner,,75,2026-05-02,
9229985409.0,active,DRANO MAX BATHROOM GEL 770ML 1,Drano Max Bathroom Gel 770ml,Drano,bathroom-cleaners,Max Bathroom Gel,,770ml,,,gel,,,Unisex,drain cleaner,,80,2026-05-02,
7039409537.0,active,PLEDGE AERO COUNTR WOOD 330M,Pledge Aerosol Country Wood 330ml,Pledge,multipurpose-cleaners,Country Wood,,330ml,,Country Wood,aerosol,,,Unisex,wood polish,,70,2026-05-02,
7031962942.0,active,AJAX FLOOR BAKIS CITRUS 750ML 1,Ajax Floor Baking Soda Citrus 750ml,Ajax,floor-cleaners,Baking Soda Citrus,,750ml,,Citrus,liquid,,,Unisex,floor cleaner,,75,2026-05-02,
9668644115.0,active,EARTH/C FLOOR CLEANER 1 LITRE,Earth Choice Floor Cleaner 1 Litre,Earth Choice,floor-cleaners,,,1L,,,liquid,,,Unisex,floor cleaner,,75,2026-05-02,
9702634621.0,active,XMICROFIBRE CLEANING CLTHS 4PK 1,Microfibre Cleaning Cloths 4 Pack,Unknown,surface-wipes,Microfibre,,4 pack,4 pack,,cloth,,,Unisex,cleaning cloths,,70,2026-05-02,
9219460342.0,active,AJAX ECO RESP WIPE VAN/BER 110,Ajax Eco Responsible Wipes Vanilla Berry 110,Ajax,surface-wipes,Vanilla Berry,,110 wipes,110 pack,Vanilla Berry,wipes,,,Unisex,cleaning wipes,,75,2026-05-02,
5832691798.0,active,AJAX BATHROOM WIPE 90PK 1,Ajax Bathroom Wipes 90 Pack,Ajax,surface-wipes,Bathroom,,90 pack,90 pack,,wipes,,,Unisex,bathroom wipes,,75,2026-05-02,
9291149412.0,active,AJAX L/HOME WIPE BERG & VAN 110 1,Ajax Long Home Wipes Bergamot and Vanilla 110,Ajax,surface-wipes,Bergamot Vanilla,,110 wipes,110 pack,Bergamot Vanilla,wipes,,,Unisex,home wipes,,75,2026-05-02,
5474499197.0,active,DETTOL ANTI/B SURFACE WIPE 110 1,Dettol Antibacterial Surface Wipes 110,Dettol,surface-wipes,Antibacterial Surface,,110 wipes,110 pack,,wipes,,,Unisex,antibacterial surface wipes,,80,2026-05-02,
961330885.0,active,MR MUSCLE SURFACE & GLASS W 30 1,Mr Muscle Surface and Glass Wipes 30,Mr Muscle,surface-wipes,Surface and Glass,,30 wipes,30 pack,,wipes,,,Unisex,surface glass wipes,,75,2026-05-02,
9877676927.0,active,GOAT A/BACT SURF WIPES 100PK 1,Goat Antibacterial Surface Wipes 100 Pack,Goat,surface-wipes,Antibacterial Surface,,100 pack,100 pack,,wipes,,,Unisex,antibacterial wipes,,75,2026-05-02,
9223034662.0,active,RAID ONE SHOT MIK O/L D/N 320G,Raid One Shot Odourless Insect Killer 320g,Raid,air-fresheners,One Shot Odourless,,320g,,,aerosol,,,Unisex,"insect killer, bug spray",,70,2026-05-02,
9223044686.0,active,RAID ONE SHOT FIK O/L D/N 320G,Raid One Shot Flying Insect Killer Odourless 320g,Raid,air-fresheners,Flying Insect Odourless,,320g,,,aerosol,,,Unisex,"fly spray, insect killer",,70,2026-05-02,
924990217.0,active,MORTEIN FAST KD IN/CON SP 300G,Mortein Fast Knockdown Indoor Control Spray 300g,Mortein,air-fresheners,Fast Knockdown,,300g,,,aerosol,,,Unisex,insect spray,,70,2026-05-02,
9284948721.0,active,MORTEIN POWERGARD FLY KILLER 300G,Mortein PowerGard Fly Killer 300g,Mortein,air-fresheners,PowerGard Fly Killer,,300g,,,aerosol,,,Unisex,fly killer,,70,2026-05-02,
9249363306.0,active,GLADE SOLID GEL CLEAN LIN 180G 1,Glade Solid Gel Clean Linen 180g,Glade,air-fresheners,Clean Linen,Solid Gel,180g,,Clean Linen,gel,,,Unisex,solid gel,,75,2026-05-02,
3222523290.0,active,GLADE SOLID GEL FL WHISPER 180G 1,Glade Solid Gel Floral Whisper 180g,Glade,air-fresheners,Floral Whisper,Solid Gel,180g,,Floral Whisper,gel,,,Unisex,solid gel,,75,2026-05-02,
7528833313.0,active,GLADE SOLID GEL LAVENDER,Glade Solid Gel Lavender,Glade,air-fresheners,Lavender,Solid Gel,,,Lavender,gel,,,Unisex,solid gel lavender,,75,2026-05-02,
7039272802.0,active,GLADE AERO CLEAN LINEN 200G 1,Glade Aerosol Clean Linen 200g,Glade,air-fresheners,Clean Linen,,200g,,Clean Linen,aerosol,,,Unisex,aerosol air freshener,,75,2026-05-02,
7039283168.0,active,GLADE AERO SUDDENLY SPRING 200G 1,Glade Aerosol Suddenly Spring 200g,Glade,air-fresheners,Suddenly Spring,,200g,,Suddenly Spring,aerosol,,,Unisex,aerosol air freshener,,75,2026-05-02,
920058392.0,active,DETTOL GLEN 2P LVD 300G,Dettol Glen 20 Lavender 300g,Dettol,air-fresheners,Lavender,Glen 20,300g,,Lavender,aerosol,,,Unisex,glen 20 disinfectant spray,,80,2026-05-02,
9289592988.0,active,XDETTOL GLEN 20 G/DIS P ORI 300G,Dettol Glen 20 Original Disinfectant Spray 300g,Dettol,air-fresheners,Original,Glen 20,300g,,Original,aerosol,,,Unisex,"glen 20, disinfectant spray",,80,2026-05-02,
9289519901.0,active,XDETTOL GLEN 20 G/DIS P CIT 300G,Dettol Glen 20 Citrus Disinfectant Spray 300g,Dettol,air-fresheners,Citrus,Glen 20,300g,,Citrus,aerosol,,,Unisex,glen 20 citrus,,80,2026-05-02,
9284870011.0,active,AW BOTANICA VAN&MA GN AUTO KIT 1,Air Wick Botanica Vanilla and Magnolia Auto Kit,Air Wick,air-fresheners,Vanilla and Magnolia,Botanica,,,Vanilla Magnolia,automatic spray kit,,,Unisex,auto kit,,75,2026-05-02,
9284890042.0,active,AW BOTANICA JAS&CN AUTO REF 1,Air Wick Botanica Jasmine and Cinnamon Auto Refill,Air Wick,air-fresheners,Jasmine and Cinnamon,Botanica,,,Jasmine Cinnamon,refill,,,Unisex,automatic refill,,75,2026-05-02,
2771000035.0,active,AW BOTANICA VNMAG AUTO REF 224 1,Air Wick Botanica Vanilla Magnolia Auto Refill,Air Wick,air-fresheners,Vanilla Magnolia,Botanica,,,Vanilla Magnolia,refill,,,Unisex,automatic refill,,75,2026-05-02,
3602857105.0,active,AW BOTAN RSPR EUC & SAGE 1,Air Wick Botanica Room Spray Eucalyptus and Sage,Air Wick,air-fresheners,Eucalyptus Sage,Botanica,,,Eucalyptus Sage,spray,,,Unisex,room spray,,75,2026-05-02,
9249724417.0,active,GLADE SENSE SPRY SYS VAN 1,Glade Sense and Spray System Vanilla,Glade,air-fresheners,Vanilla,Sense and Spray,,,Vanilla,automatic spray system,,,Unisex,sense spray system,,75,2026-05-02,
9249745058.0,active,GLADE SENSE SPRY REFIL LIM ED 1,Glade Sense and Spray Refill Limited Edition,Glade,air-fresheners,Limited Edition,Sense and Spray,,,Limited Edition,refill,,,Unisex,sense spray refill,,75,2026-05-02,
9249733923.0,active,GLADE SENSE SPRY REFIL PG CB 1,Glade Sense and Spray Refill Peony Cherry Blossom,Glade,air-fresheners,Peony Cherry Blossom,Sense and Spray,,,Peony Cherry Blossom,refill,,,Unisex,sense spray refill,,75,2026-05-02,
9289447519.0,active,GLADE E/SCEN OIL REFIL TRO BLOS,Glade Essential Oil Refill Tropical Blossom,Glade,air-fresheners,Tropical Blossom,Essential Oil,,,Tropical Blossom,refill,,,Unisex,essential oil refill,,75,2026-05-02,
9289437489.0,active,GLADE E/SCEN OIL REFILL VAN 1,Glade Essential Oil Refill Vanilla,Glade,air-fresheners,Vanilla,Essential Oil,,,Vanilla,refill,,,Unisex,essential oil refill,,75,2026-05-02,
9289427526.0,active,GLADE E/SCEN O/WARM & RL VAN 1,Glade Essential Oil Warmer and Refill Vanilla,Glade,air-fresheners,Vanilla,Essential Oil,,,Vanilla,warmer refill,,,Unisex,warmer refill,,75,2026-05-02,
9230007594.0,active,DUCK LIQ UNDER RIM CITRUS 50ML 1,Duck Liquid Under Rim Citrus 50ml,Duck,toilet-cleaners,Citrus Under Rim,,50ml,,Citrus,liquid,,,Unisex,under rim toilet cleaner,,80,2026-05-02,
9525869307.0,active,DUCK LIQ UNDER RIM MARINE 50ML 1,Duck Liquid Under Rim Marine 50ml,Duck,toilet-cleaners,Marine Under Rim,,50ml,,Marine,liquid,,,Unisex,under rim toilet cleaner,,80,2026-05-02,
9284816443.0,active,DUCK FRESH DISC LEMON PRIMARY 1,Duck Fresh Discs Lemon Primary,Duck,toilet-cleaners,Lemon,Fresh Discs,,,Lemon,disc,,,Unisex,toilet discs,,80,2026-05-02,
9229993138.0,active,DUCK FRESH DISCS CITRUS 36ML 1,Duck Fresh Discs Citrus 36ml,Duck,toilet-cleaners,Citrus,Fresh Discs,36ml,,Citrus,disc,,,Unisex,toilet discs,,80,2026-05-02,
7039323114.0,active,DUCK FRESH DISCS MARINE 36ML 1,Duck Fresh Discs Marine 36ml,Duck,toilet-cleaners,Marine,Fresh Discs,36ml,,Marine,disc,,,Unisex,toilet discs,,80,2026-05-02,
9250011160.0,active,HARPIC ACT TLT B/IN BL 2 PACK 1,Harpic Active Toilet Block In Bowl Blue 2 Pack,Harpic,toilet-cleaners,Blue In Bowl,Active,2 pack,2 pack,,toilet block,,,Unisex,toilet block,,80,2026-05-02,
9284971722.0,active,HARPIC W&S T/CIS CLEN TWIN PK 1,Harpic White and Shine Toilet Cistern Cleaner Twin Pack,Harpic,toilet-cleaners,White and Shine Cistern,,twin pack,twin pack,,toilet cleaner,,,Unisex,cistern cleaner,,80,2026-05-02,
6396552590.0,active,DUCK DEEP ACT T/G CITRUS 750ML 1,Duck Deep Action Toilet Gel Citrus 750ml,Duck,toilet-cleaners,Citrus,Deep Action,750ml,,Citrus,gel,,,Unisex,toilet gel,,80,2026-05-02,
8253742620.0,active,DUCK DEEP ACT T/G PINE 750ML 1,Duck Deep Action Toilet Gel Pine 750ml,Duck,toilet-cleaners,Pine,Deep Action,750ml,,Pine,gel,,,Unisex,toilet gel,,80,2026-05-02,
9284802774.0,active,DUCK DEEP ACT T/G L.E 750ML 1,Duck Deep Action Toilet Gel Limited Edition 750ml,Duck,toilet-cleaners,Limited Edition,Deep Action,750ml,,,gel,,,Unisex,toilet gel,,80,2026-05-02,
9250302783.0,active,ECO/S EUCA TOILET CLN 500ML,Ecostore Eucalyptus Toilet Cleaner 500ml,Ecostore,toilet-cleaners,Eucalyptus,,500ml,,Eucalyptus,liquid,,,Unisex,toilet cleaner,,80,2026-05-02,
5110985539.0,active,ECOSTORE LEM TOILET CLEANER 50 1,Ecostore Lemon Toilet Cleaner,Ecostore,toilet-cleaners,Lemon,,,,Lemon,liquid,,,Unisex,toilet cleaner,,80,2026-05-02,
9216734192.0,active,JANOLA PWR/C T/G EUC 700ML 1,Janola Power Clean Toilet Gel Eucalyptus 700ml,Janola,toilet-cleaners,Eucalyptus,Power Clean,700ml,,Eucalyptus,gel,,,Unisex,toilet gel,,80,2026-05-02,
9216724185.0,active,JANOLA PWR/C T/G LEM 700ML 1,Janola Power Clean Toilet Gel Lemon 700ml,Janola,toilet-cleaners,Lemon,Power Clean,700ml,,Lemon,gel,,,Unisex,toilet gel,,80,2026-05-02,
7034591348.0,active,HARPIC W&S T/C T/BG CTRS 450ML 1,Harpic White and Shine Toilet Cleaner Citrus 450ml,Harpic,toilet-cleaners,Citrus,White and Shine,450ml,,Citrus,liquid,,,Unisex,toilet cleaner,,80,2026-05-02,
7034585087.0,active,HARPIC FRESH POWER TOILET/C 70,Harpic Fresh Power Toilet Cleaner,Harpic,toilet-cleaners,Fresh Power,,,,,liquid,,,Unisex,toilet cleaner,,80,2026-05-02,
4398484363.0,active,VANISH NAPISAN OXI ACTION 1KG 1,Vanish Napisan Oxi Action 1kg,Vanish,laundry-stain-removers,Oxi Action,Napisan,1kg,,,powder,,,Unisex,napisan oxi action,,85,2026-05-02,
9228546659.0,active,VANISH PR G/OXI SPY U/PW 450ML 1,Vanish Preen Gold Oxi Action Spray Ultra Power 450ml,Vanish,laundry-stain-removers,Gold Oxi Spray Ultra Power,Preen,450ml,,,spray,,,Unisex,prewash spray,,85,2026-05-02,
922850166.0,active,VANISH PREN G/POW GEL,Vanish Preen Gold Power Gel,Vanish,laundry-stain-removers,Gold Power Gel,Preen,,,,gel,,,Unisex,preen gel,,80,2026-05-02,
9220449649.0,active,DETTOL WASH MACH CLNR ORG 250ML,Dettol Washing Machine Cleaner Original 250ml,Dettol,laundry-stain-removers,Original,Washing Machine Cleaner,250ml,,Original,liquid,,,Unisex,washing machine cleaner,,80,2026-05-02,
9285158125.0,active,FLUFFY GOOD SCEN T/BO 250G,Fluffy Good Scents Booster 250g,Fluffy,fabric-softeners,Good Scents,,250g,,,scent booster,,,Unisex,scent booster,,75,2026-05-02,
9254586213.0,active,FLUFFY W/WOODS SCEN T/BO 250G,Fluffy Wild Woods Scent Booster 250g,Fluffy,fabric-softeners,Wild Woods,,250g,,Wild Woods,scent booster,,,Unisex,scent booster,,75,2026-05-02,
9285128132.0,active,FLUFFY COND SCENT/BOS 500G,Fluffy Concentrated Scent Booster 500g,Fluffy,fabric-softeners,Scent Booster,,500g,,,scent booster,,,Unisex,scent booster,,75,2026-05-02,
9285148149.0,active,FLUFFY SPICE SCENT/BOOST 500G,Fluffy Spice Scent Booster 500g,Fluffy,fabric-softeners,Spice,,500g,,Spice,scent booster,,,Unisex,scent booster,,75,2026-05-02,
925460.0,active,FLUFF SHEET,Fluffy Dryer Sheets,Fluffy,fabric-softeners,Sheets,,,,,sheet,,,Unisex,dryer sheets,,70,2026-05-02,partial code only visible
2746657631.0,active,VANISH NAP G/PRO TURB PNK 1KG 1,Vanish Napisan Gold Pro Turbo Pink 1kg,Vanish,laundry-stain-removers,Gold Pro Turbo Pink,Napisan,1kg,,,powder,,,Unisex,napisan pink,,85,2026-05-02,
7617587624.0,active,VANISH NAP G/PRO TURB WHT 1KG 1,Vanish Napisan Gold Pro Turbo White 1kg,Vanish,laundry-stain-removers,Gold Pro Turbo White,Napisan,1kg,,,powder,,,Unisex,napisan white,,85,2026-05-02,
9266504410.0,active,VANISH NAP G/OXI ACT 2KG,Vanish Napisan Oxi Action 2kg,Vanish,laundry-stain-removers,Oxi Action,Napisan,2kg,,,powder,,,Unisex,napisan 2kg,,85,2026-05-02,
9266514441.0,active,VANISH NAP G/OXI CRY/WHT 2KG 1,Vanish Napisan Oxi Action Crystal White 2kg,Vanish,laundry-stain-removers,Crystal White,Napisan,2kg,,,powder,,,Unisex,"crystal white, napisan white",,85,2026-05-02,
2839956078.0,active,CUDDLY FAB CND CHRY BLSS 900ML 1,Cuddly Fabric Conditioner Cherry Blossom 900ml,Cuddly,fabric-softeners,Cherry Blossom,,900ml,,Cherry Blossom,liquid,,,Unisex,fabric conditioner,,75,2026-05-02,
,active,CUDDLY FAB SOFT CND 1L SHN FRH 1,Cuddly Fabric Softener Sunshine Fresh 1L,Cuddly,fabric-softeners,Sunshine Fresh,,1L,,Sunshine Fresh,liquid,,,Unisex,fabric softener,,75,2026-05-02,product code not visible in image
,active,DETTOL LAUNDRY SAN EUC 1.5L 1,Dettol Laundry Sanitiser Eucalyptus 1.5L,Dettol,laundry-stain-removers,Eucalyptus,Laundry Sanitiser,1.5L,,Eucalyptus,liquid,,,Unisex,"laundry sanitiser, sanitizer",,85,2026-05-02,product code not visible in image
7036074321.0,active,PERSIL L/PWD F&T SENSITIVE 2KG 1,Persil Laundry Powder Front and Top Sensitive 2kg,Persil,laundry-detergents,Sensitive,Front and Top,2kg,,,powder,,,Unisex,sensitive laundry powder,,85,2026-05-02,
7036084253.0,active,PERSIL L/PWD F&T ULTIMATE 2KG 1,Persil Laundry Powder Front and Top Ultimate 2kg,Persil,laundry-detergents,Ultimate,Front and Top,2kg,,,powder,,,Unisex,ultimate laundry powder,,85,2026-05-02,
9285110121.0,active,PERSIL F&T 3IN1 SEN 28 CAPS 1,Persil Front and Top 3 in 1 Sensitive 28 Capsules,Persil,laundry-detergents,Sensitive,3 in 1,28 caps,28 capsules,,capsule,,,Unisex,"capsules, pods",,85,2026-05-02,
9250260114.0,active,PERSIL TRIPLE CAP ACT 3IN1 28 1,Persil Triple Action 3 in 1 Capsules 28,Persil,laundry-detergents,Triple Action,3 in 1,28 caps,28 capsules,,capsule,,,Unisex,"capsules, pods",,85,2026-05-02,
923306.0,active,SURF F&T TROPICAL 50 CAPS 1,Surf Front and Top Tropical 50 Capsules,Surf,laundry-detergents,Tropical,Front and Top,50 caps,50 capsules,Tropical,capsule,,,Unisex,"capsules, pods",,80,2026-05-02,partial code visible
,active,SURF LAUNDRY/L F&T TROPICAL 2L 1,Surf Laundry Liquid Front and Top Tropical 2L,Surf,laundry-detergents,Tropical,Front and Top,2L,,Tropical,liquid,,,Unisex,laundry liquid,,80,2026-05-02,product code not visible in image
