productId,status,title,displayName,brand,groupId,variant,series,size,packSize,flavour,format,strength,ageRange,gender,keywordsExtra,imageUrl,priority,lastUpdated,notes
966343173.0,active,HASK KERATIN PROTEIN SPOO 355,Hask Keratin Protein Smoothing Shampoo 355ml,Hask,hask,Keratin Protein,Smoothing,355ml,1 pack,,shampoo,,,Unisex,"keratin,smoothing",,80,2026-05-03,
966343237.0,active,HASK KERATIN PROTEIN COND 355,Hask Keratin Protein Smoothing Conditioner 355ml,Hask,hask,Keratin Protein,Smoothing,355ml,1 pack,,conditioner,,,Unisex,"keratin,smoothing",,80,2026-05-03,
926083180.0,active,HASK COCONUT OIL SHAMPOO 355,Hask Coconut Oil Shampoo 355ml,Hask,hask,Coconut Oil,,355ml,1 pack,,shampoo,,,Unisex,"coconut oil,hydrating",,80,2026-05-03,
926083289.0,active,HASK COCONUT OIL CONDITIONER 355,Hask Coconut Oil Conditioner 355ml,Hask,hask,Coconut Oil,,355ml,1 pack,,conditioner,,,Unisex,"coconut oil,hydrating",,80,2026-05-03,
522221411.0,active,HASK CURL CARE DETANGLER SPRAY,Hask Curl Care Detangler Spray,Hask,hask,Curl Care Detangler,,175ml,1 pack,,spray,,,Unisex,"curls,detangler",,76,2026-05-03,
386121910.0,active,OGX BOND PROTEIN SPOO 385,OGX Bond Protein Shampoo 385ml,OGX,ogx,Bond Protein,,385ml,1 pack,,shampoo,,,Unisex,"bond repair,protein",,80,2026-05-03,
655351941.0,active,OGX BOND PROTEIN COND 385,OGX Bond Protein Conditioner 385ml,OGX,ogx,Bond Protein,,385ml,1 pack,,conditioner,,,Unisex,"bond repair,protein",,80,2026-05-03,
649720059.0,active,OGX COCONUT MILK SPOO 385,OGX Coconut Milk Shampoo 385ml,OGX,ogx,Coconut Milk,,385ml,1 pack,,shampoo,,,Unisex,"coconut milk,hydrating",,84,2026-05-03,
649980066.0,active,OGX COCONUT MILK COND 385,OGX Coconut Milk Conditioner 385ml,OGX,ogx,Coconut Milk,,385ml,1 pack,,conditioner,,,Unisex,"coconut milk,hydrating",,84,2026-05-03,
300160.0,active,OGX COCONUT CURLS SPOO 385,OGX Coconut Curls Shampoo 385ml,OGX,ogx,Coconut Curls,,385ml,1 pack,,shampoo,,,Unisex,"curls,coconut",,82,2026-05-03,Product ID appears as 300160 in image
300178.0,active,OGX COCONUT CURLS COND 385,OGX Coconut Curls Conditioner 385ml,OGX,ogx,Coconut Curls,,385ml,1 pack,,conditioner,,,Unisex,"curls,coconut",,82,2026-05-03,Product ID appears as 300178 in image
272630951.0,active,OGX QUENCH CURL STYLING MILK,OGX Quenching Coconut Curls Styling Milk,OGX,ogx,Quenching Coconut Curls,,,1 pack,,styling milk,,,Unisex,"curls,styling milk",,78,2026-05-03,
651026117.0,active,OGX MARGAN OIL SPOO 385,OGX Renewing Moroccan Argan Oil Shampoo 385ml,OGX,ogx,Argan Oil,Moroccan Argan Oil,385ml,1 pack,,shampoo,,,Unisex,"argan oil,moroccan oil",,84,2026-05-03,
651106129.0,active,OGX MARGAN OIL COND 385,OGX Renewing Moroccan Argan Oil Conditioner 385ml,OGX,ogx,Argan Oil,Moroccan Argan Oil,385ml,1 pack,,conditioner,,,Unisex,"argan oil,moroccan oil",,84,2026-05-03,
896170018.0,active,MAUI MOISTURE CURL QUENCH COCONUT OIL SPOO,Maui Moisture Curl Quench Coconut Oil Shampoo 385ml,Maui Moisture,maui-moisture,Curl Quench Coconut Oil,,385ml,1 pack,,shampoo,,,Unisex,"curls,coconut oil",,78,2026-05-03,
684267002.0,active,MAUI MOISTURE CURL QUENCH COCONUT OIL COND,Maui Moisture Curl Quench Coconut Oil Conditioner 385ml,Maui Moisture,maui-moisture,Curl Quench Coconut Oil,,385ml,1 pack,,conditioner,,,Unisex,"curls,coconut oil",,78,2026-05-03,
328660117.0,active,MAUI MOISTURE SHEA BUTTER SPOO 385,Maui Moisture Shea Butter Shampoo 385ml,Maui Moisture,maui-moisture,Shea Butter,,385ml,1 pack,,shampoo,,,Unisex,"shea butter,moisture",,78,2026-05-03,
328600124.0,active,MAUI MOISTURE SHEA BUTTER COND 385,Maui Moisture Shea Butter Conditioner 385ml,Maui Moisture,maui-moisture,Shea Butter,,385ml,1 pack,,conditioner,,,Unisex,"shea butter,moisture",,78,2026-05-03,
774633045.0,active,AVEENO ACV SPOO 354,Aveeno Apple Cider Vinegar Shampoo 354ml,Aveeno,aveeno-hair,Apple Cider Vinegar,,354ml,1 pack,,shampoo,,,Unisex,"apple cider vinegar,shine",,76,2026-05-03,
383663052.0,active,AVEENO ACV COND 354,Aveeno Apple Cider Vinegar Conditioner 354ml,Aveeno,aveeno-hair,Apple Cider Vinegar,,354ml,1 pack,,conditioner,,,Unisex,"apple cider vinegar,shine",,76,2026-05-03,
924953100.0,active,AVEENO FRESH GREENS BLEND SPOO 354,Aveeno Fresh Greens Blend Shampoo 354ml,Aveeno,aveeno-hair,Fresh Greens Blend,,354ml,1 pack,,shampoo,,,Unisex,"fresh greens,thickening",,76,2026-05-03,
924943113.0,active,AVEENO FRESH GREENS BLEND COND 354,Aveeno Fresh Greens Blend Conditioner 354ml,Aveeno,aveeno-hair,Fresh Greens Blend,,354ml,1 pack,,conditioner,,,Unisex,"fresh greens,thickening",,76,2026-05-03,
657789246.0,active,DOVE INTENSIVE REPAIR SHAM 350,Dove Intensive Repair Shampoo 350ml,Dove,dove-hair,Intensive Repair,,350ml,1 pack,,shampoo,,,Unisex,"intensive repair,damaged hair",,82,2026-05-03,
20236919.0,active,DOVE INTENSIVE REPAIR COND 350,Dove Intensive Repair Conditioner 350ml,Dove,dove-hair,Intensive Repair,,350ml,1 pack,,conditioner,,,Unisex,"intensive repair,damaged hair",,82,2026-05-03,
540303252.0,active,GARNIER FRUCTIS CURLS SPOO 200,Garnier Fructis Curls Shampoo 200ml,Garnier,garnier-fructis,Curls,Fructis,200ml,1 pack,,shampoo,,,Unisex,"curly hair,curls",,76,2026-05-03,
34822576.0,active,GARNIER FRUCTIS HAIR MASK 370,Garnier Fructis Hair Mask 370ml,Garnier,garnier-fructis,Hair Mask,Fructis,370ml,1 pack,,mask,,,Unisex,"hair food,mask",,78,2026-05-03,
957002583.0,active,GARNIER FRUCTIS CURL SPRAY 150,Garnier Fructis Curl Spray 150ml,Garnier,garnier-fructis,Curl Spray,Fructis,150ml,1 pack,,spray,,,Unisex,"curl spray,curls",,72,2026-05-03,
747696962.0,active,GARNIER FRUCTIS HNFSHNE SPOO 315,Garnier Fructis Hair Nutrition Shine Shampoo 315ml,Garnier,garnier-fructis,Shine,Fructis,315ml,1 pack,,shampoo,,,Unisex,shine,,74,2026-05-03,Name partly unclear
743526359.0,active,GARNIER FRUCTIS HAIR FOOD MACA 390,Garnier Fructis Hair Food Macadamia 390ml,Garnier,garnier-fructis,Macadamia,Hair Food,390ml,1 pack,,mask,,,Unisex,"macadamia,hair food,mask",,82,2026-05-03,
743527360.0,active,GARNIER FRUCTIS HAIR FOOD PAPAYA 390,Garnier Fructis Hair Food Papaya 390ml,Garnier,garnier-fructis,Papaya,Hair Food,390ml,1 pack,,mask,,,Unisex,"papaya,hair food,mask",,82,2026-05-03,
743525358.0,active,GARNIER FRUCTIS HAIR FOOD BANANA 390,Garnier Fructis Hair Food Banana 390ml,Garnier,garnier-fructis,Banana,Hair Food,390ml,1 pack,,mask,,,Unisex,"banana,hair food,mask",,82,2026-05-03,
821393113.0,active,PALMOLIVE NAT MOIST SHAM 350,Palmolive Naturals Moisture Shampoo 350ml,Palmolive,palmolive-hair,Moisture,Naturals,350ml,1 pack,,shampoo,,,Unisex,"moisture,naturals",,76,2026-05-03,
928624453.0,active,PALMOLIVE NAT MOIST COND 350,Palmolive Naturals Moisture Conditioner 350ml,Palmolive,palmolive-hair,Moisture,Naturals,350ml,1 pack,,conditioner,,,Unisex,"moisture,naturals",,76,2026-05-03,
182053100.0,active,PALMOLIVE NAT NOURISH SPOO 350,Palmolive Naturals Nourish Shampoo 350ml,Palmolive,palmolive-hair,Nourish,Naturals,350ml,1 pack,,shampoo,,,Unisex,"nourish,naturals",,76,2026-05-03,
182065446.0,active,PALMOLIVE NAT NOURISH COND 350,Palmolive Naturals Nourish Conditioner 350ml,Palmolive,palmolive-hair,Nourish,Naturals,350ml,1 pack,,conditioner,,,Unisex,"nourish,naturals",,76,2026-05-03,
184796324.0,active,PALMOLIVE NAT MOIST SPOO 700,Palmolive Naturals Moisture Shampoo 700ml,Palmolive,palmolive-hair,Moisture,Naturals,700ml,1 pack,,shampoo,,,Unisex,"moisture,value size",,80,2026-05-03,
184770337.0,active,PALMOLIVE NAT NOURISH COND 700,Palmolive Naturals Nourish Conditioner 700ml,Palmolive,palmolive-hair,Nourish,Naturals,700ml,1 pack,,conditioner,,,Unisex,"nourish,value size",,80,2026-05-03,
927418552.0,active,PALMOLIVE KIDS 3IN1 350,Palmolive Kids 3 in 1 350ml,Palmolive,palmolive-hair,Kids 3 in 1,,350ml,1 pack,,shampoo and body wash,,Kids,Unisex,"kids,3 in 1",,82,2026-05-03,
9233349235.0,active,SUNSILK LONG & STRONG SPOO 350,Sunsilk Long & Strong Shampoo 350ml,Sunsilk,sunsilk,Long & Strong,,350ml,1 pack,,shampoo,,,Unisex,"long hair,strong hair",,76,2026-05-03,
923335978.0,active,SUNSILK LONG & STRONG COND 350,Sunsilk Long & Strong Conditioner 350ml,Sunsilk,sunsilk,Long & Strong,,350ml,1 pack,,conditioner,,,Unisex,"long hair,strong hair",,76,2026-05-03,
923342204.0,active,SUNSILK LONG & STRONG SPOO 700,Sunsilk Long & Strong Shampoo 700ml,Sunsilk,sunsilk,Long & Strong,,700ml,1 pack,,shampoo,,,Unisex,"long hair,strong hair,value size",,80,2026-05-03,
923343081.0,active,SUNSILK LONG & STRONG COND 700,Sunsilk Long & Strong Conditioner 700ml,Sunsilk,sunsilk,Long & Strong,,700ml,1 pack,,conditioner,,,Unisex,"long hair,strong hair,value size",,80,2026-05-03,
923344241.0,active,SUNSILK BRILLIANT SHINE SPOO 700,Sunsilk Brilliant Shine Shampoo 700ml,Sunsilk,sunsilk,Brilliant Shine,,700ml,1 pack,,shampoo,,,Unisex,"shine,brilliant shine",,80,2026-05-03,
923345067.0,active,SUNSILK BRILLIANT SHINE COND 700,Sunsilk Brilliant Shine Conditioner 700ml,Sunsilk,sunsilk,Brilliant Shine,,700ml,1 pack,,conditioner,,,Unisex,"shine,brilliant shine",,80,2026-05-03,
268062848.0,active,HERBAL ESSENCES B/R ARG OIL SPOO,Herbal Essences Bio Renew Argan Oil Shampoo,Herbal Essences,herbal-essences,Argan Oil,Bio Renew,,1 pack,,shampoo,,,Unisex,"argan oil,bio renew",,76,2026-05-03,
268942879.0,active,HERBAL ESSENCES B/R ARG OIL COND,Herbal Essences Bio Renew Argan Oil Conditioner,Herbal Essences,herbal-essences,Argan Oil,Bio Renew,,1 pack,,conditioner,,,Unisex,"argan oil,bio renew",,76,2026-05-03,
268372428.0,active,HERBAL ESSENCES B/R COC SHAM,Herbal Essences Bio Renew Coconut Shampoo,Herbal Essences,herbal-essences,Coconut,Bio Renew,,1 pack,,shampoo,,,Unisex,"coconut,bio renew",,76,2026-05-03,
268045459.0,active,HERBAL ESSENCES B/R COC COND,Herbal Essences Bio Renew Coconut Conditioner,Herbal Essences,herbal-essences,Coconut,Bio Renew,,1 pack,,conditioner,,,Unisex,"coconut,bio renew",,76,2026-05-03,
36137168.0,active,HERBAL ESSENCES CLASSIC SHAM 400,Herbal Essences Classic Shampoo 400ml,Herbal Essences,herbal-essences,Classic,,400ml,1 pack,,shampoo,,,Unisex,classic clean,,74,2026-05-03,
431662151.0,active,HERBAL ESSENCES CLASSIC COND 400,Herbal Essences Classic Conditioner 400ml,Herbal Essences,herbal-essences,Classic,,400ml,1 pack,,conditioner,,,Unisex,classic clean,,74,2026-05-03,
984691283.0,active,KLORANE SPOO QUININE EDEL 400,Klorane Shampoo with Quinine & Edelweiss 400ml,Klorane,klorane,Quinine & Edelweiss,,400ml,1 pack,,shampoo,,,Unisex,"quinine,edelweiss",,74,2026-05-03,
740791436.0,active,KLORANE QUININE STRENGTH COND 200,Klorane Quinine Strengthening Conditioner 200ml,Klorane,klorane,Quinine Strengthening,,200ml,1 pack,,conditioner,,,Unisex,"strengthening,quinine",,74,2026-05-03,
770375076.0,active,KLORANE SPOO PEONY 400,Klorane Shampoo with Peony 400ml,Klorane,klorane,Peony,,400ml,1 pack,,shampoo,,,Unisex,"peony,sensitive scalp",,74,2026-05-03,
359724871.0,active,KLORANE SPOO ORG MINT 400,Klorane Organic Mint Shampoo 400ml,Klorane,klorane,Organic Mint,,400ml,1 pack,,shampoo,,,Unisex,"mint,oily hair",,74,2026-05-03,
878978727.0,active,KLORANE SPOO CUPUAÇU 400,Klorane Cupuaçu Shampoo 400ml,Klorane,klorane,Cupuaçu,,400ml,1 pack,,shampoo,,,Unisex,"cupuacu,cupuaçu,nourishing",,74,2026-05-03,
90131.0,active,KLORANE OIL/SPOO ORG NETTLE 400,Klorane Oil Control Shampoo with Organic Nettle 400ml,Klorane,klorane,Organic Nettle,,400ml,1 pack,,shampoo,,,Unisex,"nettle,oily hair,oil control",,74,2026-05-03,Product ID appears partly visible
923543149.0,active,GLOW LAB HYDRA SPOO 600,Glow Lab Hydrating Shampoo 600ml,Glow Lab,glow-lab,Hydrating,,600ml,1 pack,,shampoo,,,Unisex,hydrating,,72,2026-05-03,
923543163.0,active,GLOW LAB HYDRA COND 600,Glow Lab Hydrating Conditioner 600ml,Glow Lab,glow-lab,Hydrating,,600ml,1 pack,,conditioner,,,Unisex,hydrating,,72,2026-05-03,
330866034.0,active,GLOW LAB SH/GLOSS SHAM 600,Glow Lab Shine/Gloss Shampoo 600ml,Glow Lab,glow-lab,Shine Gloss,,600ml,1 pack,,shampoo,,,Unisex,"shine,gloss",,72,2026-05-03,
649386041.0,active,GLOW LAB SH/GLOSS COND 600,Glow Lab Shine/Gloss Conditioner 600ml,Glow Lab,glow-lab,Shine Gloss,,600ml,1 pack,,conditioner,,,Unisex,"shine,gloss",,72,2026-05-03,
966027939.0,active,ECOSTORE COLOUR SHAMPOO 350 NEW,Ecostore Colour Shampoo 350ml,Ecostore,ecostore-hair,Colour,,350ml,1 pack,,shampoo,,,Unisex,"colour care,eco",,72,2026-05-03,
353607946.0,active,ECOSTORE COLOUR CONDITIONER 350 NEW,Ecostore Colour Conditioner 350ml,Ecostore,ecostore-hair,Colour,,350ml,1 pack,,conditioner,,,Unisex,"colour care,eco",,72,2026-05-03,
9278784772.0,active,Salon Pro Powder White Bleach 250g,Salon Pro Powder White Bleach 250g,Salon Pro,salon-pro-developer,White Bleach,,250g,,,bleach,,,,White Bleach,,70,2026-05-03,Transcribed from image; verify barcode before upload
9278664734.0,active,Salon Pro Peroxide Vol 10 250ml,Salon Pro Peroxide Vol 10 250ml,Salon Pro,salon-pro-developer,10 Vol,Developer,250ml,,,developer,,,,10 Vol,,70,2026-05-03,Transcribed from image; verify barcode before upload
9278704741.0,active,Salon Pro Creme Peroxide Vol 20 250ml,Salon Pro Creme Peroxide Vol 20 250ml,Salon Pro,salon-pro-developer,20 Vol,Developer,250ml,,,developer,,,,20 Vol,,70,2026-05-03,Transcribed from image; verify barcode before upload
9278724703.0,active,Salon Pro Creme Peroxide Vol 20 500ml,Salon Pro Creme Peroxide Vol 20 500ml,Salon Pro,salon-pro-developer,20 Vol,Developer,500ml,,,developer,,,,20 Vol,,70,2026-05-03,Transcribed from image; verify barcode before upload
9278744710.0,active,Salon Pro Creme Peroxide Vol 30 500ml,Salon Pro Creme Peroxide Vol 30 500ml,Salon Pro,salon-pro-developer,30 Vol,Developer,500ml,,,developer,,,,30 Vol,,70,2026-05-03,Transcribed from image; verify barcode before upload
9278764727.0,active,Salon Pro Creme Peroxide Vol 40 500ml,Salon Pro Creme Peroxide Vol 40 500ml,Salon Pro,salon-pro-developer,40 Vol,Developer,500ml,,,developer,,,,40 Vol,,70,2026-05-03,Transcribed from image; verify barcode before upload
8363788300.0,active,Vitality Colour Off Remover,Vitality Colour Off Remover,Vitality,vitality-bleach-developer,Colour Off Remover,,,,,colour remover,,,,Colour Off Remover,,76,2026-05-03,Transcribed from image; verify barcode before upload
9713676230.0,active,Vitality Bleach Powder Blue,Vitality Bleach Powder Blue,Vitality,vitality-bleach-developer,Blue Bleach,,500g,,,bleach powder,,,,Blue Bleach,,74,2026-05-03,Transcribed from image; verify barcode before upload
9713319500.0,active,Vitality Cream Developer 10 Vol,Vitality Cream Developer 10 Vol,Vitality,vitality-bleach-developer,10 Vol,Developer,500ml,,,developer,,,,10 Vol,,70,2026-05-03,Transcribed from image; verify barcode before upload
9713419501.0,active,Vitality Cream Developer 25 Vol,Vitality Cream Developer 25 Vol,Vitality,vitality-bleach-developer,25 Vol,Developer,500ml,,,developer,,,,25 Vol,,70,2026-05-03,Transcribed from image; verify barcode before upload
9713571915.0,active,Vitality Cream Developer 38 Vol,Vitality Cream Developer 38 Vol,Vitality,vitality-bleach-developer,38 Vol,Developer,500ml,,,developer,,,,38 Vol,,70,2026-05-03,Transcribed from image; verify barcode before upload
3109323079.0,active,Schwarzkopf Nordic Blonde Anti-Yellow Toner,Schwarzkopf Nordic Blonde Anti-Yellow Toner,Schwarzkopf,nordic-blonde-toner,Anti Yellow Toner,Nordic Blonde,,,,toner,,,,Anti Yellow Toner,,82,2026-05-03,Transcribed from image; verify barcode before upload
9728365752.0,active,Schwarzkopf Nordic Blonde Refresh Mousse,Schwarzkopf Nordic Blonde Refresh Mousse,Schwarzkopf,nordic-blonde-toner,Refresh Mousse,Nordic Blonde,,,,mousse,,,,Refresh Mousse,,80,2026-05-03,Transcribed from image; verify barcode before upload
7613085745.0,active,Schwarzkopf Nordic Blonde S/B Blonde,Schwarzkopf Nordic Blonde S/B Blonde,Schwarzkopf,nordic-blonde-toner,Blonde,Nordic Blonde,,,,hair colour,,,,Blonde,,78,2026-05-03,Transcribed from image; verify barcode before upload
923753218.0,active,Schwarzkopf Nordic Blonde Kit Ultra,Schwarzkopf Nordic Blonde Kit Ultra,Schwarzkopf,nordic-blonde-toner,Ultra,Nordic Blonde,,,,lightener kit,,,,Ultra,,78,2026-05-03,Product ID partly unclear from image
64452759.0,active,L’Oreal Preference Platinum,L’Oreal Preference Platinum,L’Oreal Paris,loreal-pref-blonde,Platinum,Preference,,,,hair colour,,,,Platinum,,82,2026-05-03,Product ID partly unclear from image
344363091.0,active,L’Oreal Preference Toner Pearly Beige,L’Oreal Preference Toner Pearly Beige,L’Oreal Paris,loreal-pref-blonde,Pearly Beige Toner,Preference,,,,toner,,,,Pearly Beige Toner,,82,2026-05-03,Product ID partly unclear from image
7996483084.0,active,L’Oreal Preference Toner Platinum,L’Oreal Preference Toner Platinum,L’Oreal Paris,loreal-pref-blonde,Platinum Toner,Preference,,,,toner,,,,Platinum Toner,,82,2026-05-03,Transcribed from image; verify barcode before upload
6532880175.0,active,Clairol Frost & Tip,Clairol Frost & Tip,Clairol,clairol-blonde,Frost & Tip,,,,,highlight kit,,,,Frost & Tip,,75,2026-05-03,Transcribed from image; verify barcode before upload
7787322217.0,active,Clairol Blonde It Up Platinum Blonde,Clairol Blonde It Up Platinum Blonde,Clairol,clairol-blonde,Platinum Blonde,Blonde It Up,,,,hair colour,,,,Platinum Blonde,,78,2026-05-03,Transcribed from image; verify barcode before upload
689111454.0,active,Clairol Blonde It Up S/Pearl,Clairol Blonde It Up S/Pearl,Clairol,clairol-blonde,Pearl,Blonde It Up,,,,hair colour,,,,Pearl,,70,2026-05-03,Product ID partly unclear from image
3610090404.0,active,Schwarzkopf Live Semi Permanent Toner,Schwarzkopf Live Semi Permanent Toner,Schwarzkopf,schwarzkopf-live-colour,Toner,Live,,,,semi permanent hair colour,,,,Toner,,78,2026-05-03,Transcribed from image; verify barcode before upload
114160435.0,active,Schwarzkopf Live Permanent Max Blonde,Schwarzkopf Live Permanent Max Blonde,Schwarzkopf,schwarzkopf-live-colour,Max Blonde,Live,,,,permanent hair colour,,,,Max Blonde,,78,2026-05-03,Product ID partly unclear from image
86733780.0,active,Schwarzkopf Live Ultra Bright Blue,Schwarzkopf Live Ultra Bright Blue,Schwarzkopf,schwarzkopf-live-colour,Ultra Bright Blue,Live,,,,hair colour,,,,Ultra Bright Blue,,80,2026-05-03,Product ID partly unclear from image
77569794.0,active,Schwarzkopf Live Ultra Bright Magenta,Schwarzkopf Live Ultra Bright Magenta,Schwarzkopf,schwarzkopf-live-colour,Ultra Bright Magenta,Live,,,,hair colour,,,,Ultra Bright Magenta,,80,2026-05-03,Product ID partly unclear from image
697639777.0,active,Schwarzkopf Live Ultra Bright Shock Pink,Schwarzkopf Live Ultra Bright Shock Pink,Schwarzkopf,schwarzkopf-live-colour,Shock Pink,Live,,,,hair colour,,,,Shock Pink,,80,2026-05-03,Product ID partly unclear from image
993937749.0,active,Schwarzkopf Live Colour Cotton Candy Pink,Schwarzkopf Live Colour Cotton Candy Pink,Schwarzkopf,schwarzkopf-live-colour,Cotton Candy Pink,Live,,,,hair colour,,,,Cotton Candy Pink,,80,2026-05-03,Product ID partly unclear from image
1778357817.0,active,Schwarzkopf Live Colour Purple Grey,Schwarzkopf Live Colour Purple Grey,Schwarzkopf,schwarzkopf-live-colour,Purple Grey,Live,,,,hair colour,,,,Purple Grey,,80,2026-05-03,Transcribed from image; verify barcode before upload
1841263970.0,active,Schwarzkopf Live Colour Deep Black 75ml,Schwarzkopf Live Colour Deep Black 75ml,Schwarzkopf,schwarzkopf-live-colour,Deep Black,Live,75ml,,,hair colour,,,,Deep Black,,80,2026-05-03,Transcribed from image; verify barcode before upload
7690703956.0,active,Schwarzkopf Live Colour Chocolate 75ml,Schwarzkopf Live Colour Chocolate 75ml,Schwarzkopf,schwarzkopf-live-colour,Chocolate,Live,75ml,,,hair colour,,,,Chocolate,,80,2026-05-03,Transcribed from image; verify barcode before upload
637043949.0,active,Schwarzkopf Live Colour Brown 75ml,Schwarzkopf Live Colour Brown 75ml,Schwarzkopf,schwarzkopf-live-colour,Brown,Live,75ml,,,hair colour,,,,Brown,,78,2026-05-03,Product ID partly unclear from image
180434407.0,active,Schwarzkopf Live Colour Burgundy 75ml,Schwarzkopf Live Colour Burgundy 75ml,Schwarzkopf,schwarzkopf-live-colour,Burgundy,Live,75ml,,,hair colour,,,,Burgundy,,78,2026-05-03,Product ID partly unclear from image
875535756.0,active,Schwarzkopf Live Colour Purple,Schwarzkopf Live Colour Purple,Schwarzkopf,schwarzkopf-live-colour,Purple,Live,,,,hair colour,,,,Purple,,78,2026-05-03,Product ID partly unclear from image
95675055.0,active,Scott Cornwall Decolour Remover,Scott Cornwall Decolour Remover,Scott Cornwall,colour-remover,Decolour Remover,,,,,colour remover,,,,Decolour Remover,,82,2026-05-03,Product ID partly unclear from image
951829079.0,active,Scott Cornwall Decolour Stripper,Scott Cornwall Decolour Stripper,Scott Cornwall,colour-remover,Decolour Stripper,,,,,colour stripper,,,,Decolour Stripper,,82,2026-05-03,Product ID partly unclear from image
9285168112.0,active,Colourless Hair Colour Remover,Colourless Hair Colour Remover,Colourless,colour-remover,Hair Colour Remover,,,,,colour remover,,,,Hair Colour Remover,,84,2026-05-03,Transcribed from image; verify barcode before upload
1315614389.0,active,Nishman Colour Spray White,Nishman Colour Spray White,Nishman,nishman-colour-spray,White,Colour Spray,,,,spray,,,,White,,70,2026-05-03,Transcribed from image; verify barcode before upload
271391694.0,active,Schwarzkopf Root Retouch Black,Schwarzkopf Root Retouch Black,Schwarzkopf,schwarzkopf-root-touchup,Black,Root Touch Up,,,,root spray,,,,Black,,76,2026-05-03,Product ID partly unclear from image
271403160.0,active,Schwarzkopf Root Retouch Dark Brown,Schwarzkopf Root Retouch Dark Brown,Schwarzkopf,schwarzkopf-root-touchup,Dark Brown,Root Touch Up,,,,root spray,,,,Dark Brown,,76,2026-05-03,Product ID partly unclear from image
271431762.0,active,Schwarzkopf Root Retouch Dark Brown Spray,Schwarzkopf Root Retouch Dark Brown Spray,Schwarzkopf,schwarzkopf-root-touchup,Dark Brown Spray,Root Touch Up,,,,root spray,,,,Dark Brown Spray,,76,2026-05-03,Product ID partly unclear from image
744161972.0,active,Schwarzkopf Root Retouch Spray Black,Schwarzkopf Root Retouch Spray Black,Schwarzkopf,schwarzkopf-root-touchup,Black,Root Touch Up,,,,root spray,,,,Black,,76,2026-05-03,Product ID partly unclear from image
744161979.0,active,Schwarzkopf Root Retouch Spray Dark Brown,Schwarzkopf Root Retouch Spray Dark Brown,Schwarzkopf,schwarzkopf-root-touchup,Dark Brown,Root Touch Up,,,,root spray,,,,Dark Brown,,76,2026-05-03,Product ID partly unclear from image
7513852993.0,active,Schwarzkopf Root Retouch Light Brown,Schwarzkopf Root Retouch Light Brown,Schwarzkopf,schwarzkopf-root-touchup,Light Brown,Root Touch Up,,,,root spray,,,,Light Brown,,76,2026-05-03,Product ID partly unclear from image
751412127.0,active,Clairol Nice’n Easy Root Touch Up Powder Dark Brown,Clairol Nice’n Easy Root Touch Up Powder Dark Brown,Clairol,clairol-root-touchup,Dark Brown,Nice’n Easy Root Touch Up,,,,powder,,,,Dark Brown,,80,2026-05-03,Product ID partly unclear from image
7441468581.0,active,Clairol Nice’n Easy Root Touch Up Light Brown,Clairol Nice’n Easy Root Touch Up Light Brown,Clairol,clairol-root-touchup,Light Brown,Nice’n Easy Root Touch Up,,,,root touch up,,,,Light Brown,,80,2026-05-03,Transcribed from image; verify barcode before upload
751102006.0,active,Clairol Nice’n Easy Root Touch Up Medium Blonde,Clairol Nice’n Easy Root Touch Up Medium Blonde,Clairol,clairol-root-touchup,Medium Blonde,Nice’n Easy Root Touch Up,,,,root touch up,,,,Medium Blonde,,80,2026-05-03,Transcribed from image; verify barcode before upload
744142084.0,active,Clairol Nice’n Easy Root Touch Up Auburn,Clairol Nice’n Easy Root Touch Up Auburn,Clairol,clairol-root-touchup,Auburn,Nice’n Easy Root Touch Up,,,,root touch up,,,,Auburn,,78,2026-05-03,Product ID partly unclear from image
611181587.0,active,L’Oreal Magic Retouch 2 Soft Black,L’Oreal Magic Retouch 2 Soft Black,L’Oreal Paris,loreal-root-touchup,Soft Black,Magic Retouch,,,,root spray,,,,Soft Black,,82,2026-05-03,Product ID partly unclear from image
9918961594.0,active,L’Oreal Magic Retouch Darkest Brown,L’Oreal Magic Retouch Darkest Brown,L’Oreal Paris,loreal-root-touchup,Darkest Brown,Magic Retouch,,,,root spray,,,,Darkest Brown,,82,2026-05-03,Transcribed from image; verify barcode before upload
239871600.0,active,L’Oreal Magic Retouch Dark Brown,L’Oreal Magic Retouch Dark Brown,L’Oreal Paris,loreal-root-touchup,Dark Brown,Magic Retouch,,,,root spray,,,,Dark Brown,,82,2026-05-03,Product ID partly unclear from image
6403991617.0,active,L’Oreal Magic Retouch Brown,L’Oreal Magic Retouch Brown,L’Oreal Paris,loreal-root-touchup,Brown,Magic Retouch,,,,root spray,,,,Brown,,82,2026-05-03,Transcribed from image; verify barcode before upload
901948402.0,active,L’Oreal Casting Creme Gloss 200 Ebony Black,L’Oreal Casting Creme Gloss 200 Ebony Black,L’Oreal Paris,loreal-casting-creme-gloss,Ebony Black,Casting Creme Gloss,,,,hair colour,,,,Ebony Black,,84,2026-05-03,Transcribed from image; verify barcode before upload
901978426.0,active,L’Oreal Casting Creme Gloss 300 Darkest Brown,L’Oreal Casting Creme Gloss 300 Darkest Brown,L’Oreal Paris,loreal-casting-creme-gloss,Darkest Brown,Casting Creme Gloss,,,,hair colour,,,,Darkest Brown,,84,2026-05-03,Transcribed from image; verify barcode before upload
9237596530.0,active,L’Oreal Casting Creme Gloss 323 Dark Chocolate,L’Oreal Casting Creme Gloss 323 Dark Chocolate,L’Oreal Paris,loreal-casting-creme-gloss,Dark Chocolate,Casting Creme Gloss,,,,hair colour,,,,Dark Chocolate,,84,2026-05-03,Transcribed from image; verify barcode before upload
9015048471.0,active,L’Oreal Casting Creme Gloss 500 Light Brown,L’Oreal Casting Creme Gloss 500 Light Brown,L’Oreal Paris,loreal-casting-creme-gloss,Light Brown,Casting Creme Gloss,,,,hair colour,,,,Light Brown,,84,2026-05-03,Transcribed from image; verify barcode before upload
