term,synonyms,searchBoost,department,notes
pacifier,"dummy, soother, binky, paci, pacifier, dummie, soother dummy",high,Baby,Common NZ/AU and US terms
baby bottle,"bottle, feeding bottle, milk bottle, infant bottle, btl, botl, bottl",high,Baby,Covers planogram abbreviations
teat,"nipple, bottle teat, teat, flow teat, silicone teat",high,Baby,US customers may search nipple
sippy cup,"sippy cup, straw cup, trainer cup, training cup, spout cup, toddler cup, 360 cup, drink bottle",high,Baby,Cups and toddler drinking
teether,"teether, teething toy, chew toy, gum massager, chewing teether, chewies",high,Baby,Teething related searches
breast pump,"breastpump, pump, milk pump, electric pump, manual pump, nursing pump",high,Baby,Breastfeeding pump searches
breast milk storage,"milk bags, breastmilk bags, milk storage, storage bags, milk container, breastmilk container",medium,Baby,Milk storage products
steriliser,"sterilizer, steriliser, steam steriliser, steam sterilizer, microwave steriliser, bottle steriliser",high,Baby,UK/NZ and US spelling
bottle warmer,"warmer, bottle warmer, pouch warmer, milk warmer",medium,Baby,Bottle/pouch warming
nipple shield,"nipple shield, breast shield, contact shield, nursing shield, shield",medium,Baby,Breastfeeding accessories
cleanser,"cleanser, cleaner, bottle cleaner, bottle cleanser, liquid cleanser, antibacterial, sterilising solution",medium,Baby,Bottle cleaning and Milton/Pigeon items
drying rack,"drying rack, dry rack, bottle rack, grass rack, boon grass, drying mat",medium,Baby,Boon drying rack terms
baby oral care,"toothbrush, baby toothbrush, finger brush, oral care, gum brush, massaging toothbrush",medium,Baby,Baby oral care products
food feeder,"feeder, fresh food feeder, fruit feeder, squeeze feeder, food pouch, weaning feeder",medium,Baby,Weaning and feeding accessories
bibs,"bib, bibs, feeding bib, milk bib, disposable bib",medium,Baby,Baby feeding bibs
baby wipes,"wipes, wet wipes, water wipes, nappy wipes, diaper wipes, wipes for babies, fragrance free wipes, sensitive wipes",high,Baby,General customer search terms for baby wipes
nappy rash,"diaper rash, nappy cream, diaper cream, rash cream, barrier cream, zinc cream, sudocrem, bepanthen",high,Baby,NZ customers may use nappy; some may search diaper
baby wash,"baby body wash, top to toe wash, baby cleanser, baby bath wash, wash and shampoo, hair and body wash",high,Baby,General baby cleansing terms
baby shampoo,"baby hair wash, baby spoo, kids shampoo, gentle shampoo, cradle cap shampoo",high,Baby,SPoo is common planogram abbreviation for shampoo
baby lotion,"baby moisturiser, baby moisturizer, body lotion, baby cream, moisturising lotion, hydrating lotion",high,Baby,NZ/AU and US spelling variations
eczema baby,"eczma, excema, exzema, eczema cream, dermatitis baby, dry skin baby, sensitive skin baby",high,Baby,Common misspellings and need-based search
breastfeeding,"nursing pads, breast pads, nipple cream, lanolin, nipple balm, hydrogel pads, maternity pads",high,Baby,For mums shelf terms
baby powder,"powder, nappy powder, corn starch, cornstarch, rash powder, medicated powder",medium,Baby,Powders shelf terms
cradle cap,"cradlecap, cradle cap cream, cradle cap lotion, scalp flakes baby",medium,Baby,Baby scalp care
fragrance free,"ff, f/f, frag free, unscented, no fragrance, sensitive",high,Baby,Frequent abbreviation in product labels
organic baby,"natural baby, organic care, biodegradable, bio d, plant based, eco baby",medium,Baby,Search expansion for natural products
kids hair care,"kids shampoo, kids conditioner, detangler, detangling spray, styling gel, hair spray",medium,Baby,Kids hair products within baby aisle
nappy bags,"diaper bags, disposable nappy bags, scented bags, baby bags, biodegradable nappy bags",medium,Baby,Nappy disposal products
nappies,"diapers,nappy,diaper,baby nappies,baby diapers,disposable nappies",high,Baby,NZ term nappies; US term diapers
nappy pants,"pants,pull ups,pull-ups,training pants,pullup nappies,nappy pant",high,Baby,For toddlers and older babies
swim nappies,"swimmers,swim pants,pool nappies,beach nappies,little swimmers",high,Baby,For swimming and water play
night nappies,"overnight nappies,night pants,dry nights,drynites,bed wetting,bedwetting,o/b,sleepy nights",high,Baby,For overnight and bedwetting searches
newborn nappies,"new born,newborn,new baby,infant,premmie,preemie,premature baby,small baby",high,Baby,Newborn and premmie size searches
size 1 nappies,"s1,size1,newborn size,nb",medium,Baby,Size search expansion
size 2 nappies,"s2,size2,infant",medium,Baby,Size search expansion
size 3 nappies,"s3,size3,6-11kg",medium,Baby,Size search expansion
size 4 nappies,"s4,size4,toddler,crawler,10-15kg",medium,Baby,Size search expansion
size 5 nappies,"s5,size5,walker,13-18kg",medium,Baby,Size search expansion
size 6 nappies,"s6,size6,junior,16kg plus,16kg+",medium,Baby,Size search expansion
eco nappies,"organic nappies,natural nappies,plant based nappies,sustainable nappies,eco diapers",medium,Baby,Eco/natural product searches
Huggies,"huggie,hugies,huggy,huggys",high,Baby,Common misspellings
BabyLove,"baby love,babylove,baby luv,babyluv",high,Baby,Common spacing variations
Bunjie,"bunji,bungee,bunjy,bunjie baby",medium,Baby,Possible misspellings
Tooshies,"toosh,tooshie,tooshies eco,tooshys",medium,Baby,Possible misspellings
baby formula,"infant formula,baby milk,milk powder,formula powder,infant milk,toddler milk,follow on formula,follow-on milk,growing up milk,stage 1,stage 2,stage 3,stage 4",high,Baby,
goat formula,"goat milk formula,goat baby milk,goat infant formula,goat toddler milk",high,Baby,
A2 formula,"A2 milk,A2 baby milk,A2 infant formula,a2 formula",high,Baby,
reflux formula,"anti reflux,thickened formula,reflux milk,spit up formula,feed thickener",high,Baby,
sensitive formula,"sensitive baby milk,gentle formula,colic formula,constipation formula,comfort formula",high,Baby,
baby food,"baby puree,baby pouch,baby meal,baby dinner,baby breakfast,weaning food,solids,starting solids",high,Baby,
baby snacks,"kids snacks,baby biscuits,rice rusks,baby rusks,puffs,melts,sticks,wafers,rice cakes,teething biscuits",high,Baby,
baby cereal,"rice cereal,baby rice,porridge,baby porridge,muesli,infant cereal",high,Baby,
organic baby food,"organic pouch,organic puree,Only Organic,Bubs Organic,organic snacks",medium,Baby,
custard,"baby custard,banana custard,vanilla custard,fruit custard",medium,Baby,
weaning,"starting solids,first foods,baby solids,solid food",medium,Baby,
PediaSure,"pediasure,kids nutrition,kids shake,nutrition drink,children shake",high,Baby,
Karicare,"kari care,karicare plus,karicare gold,karicare goat,karicare soy",high,Baby,
Aptamil,"aptamil gold,aptamil profutura,aptamil prof syn,aptamil sensitive,apta grow",high,Baby,
S-26,"S26,s 26,S-26 Gold,S26 comfort,S26 newborn",high,Baby,
tissues,"facial tissue, face tissue, tissue box, kleenex, nose tissue, soft tissue",high,Household,general tissue search terms
pocket tissues,"travel tissues, handbag tissues, mini tissues, purse tissues, pocket pack",high,Household,
toilet paper,"loo roll, toilet roll, bathroom tissue, toilet tissue, toilet products",high,Household,
paper towel,"kitchen towel, kitchen paper, kitchen roll, absorbent towel",high,Household,
wipes,"wet wipes, cleaning wipes, surface wipes, antibacterial wipes, flushable wipes",high,Household,
dishwashing,"dish wash, dishwasher tablets, dishwasher tabs, dishwashing liquid, dish liquid, dish soap, washing up liquid",high,Household,
multipurpose cleaner,"multi purpose cleaner, all purpose cleaner, spray and wipe, surface cleaner, surface spray",high,Household,
bathroom cleaner,"shower cleaner, bath cleaner, toilet cleaner, mould remover, mold remover, scum remover, bleach",high,Household,
floor cleaner,"floor wash, mopping liquid, floor liquid, floor spray",medium,Household,
air freshener,"room spray, deodoriser, deodorizer, fragrance, scent, automatic spray, room freshener, refill",high,Household,
insect spray,"bug spray, fly spray, insect killer, raid, mortein",medium,Household,insect sprays are located near air fresheners in the provided image
toilet cleaner,"toilet gel, toilet duck, harpic, toilet block, rim block, toilet discs, cistern cleaner",high,Household,
laundry detergent,"washing powder, washing liquid, laundry liquid, laundry powder, detergent, laundry caps, pods, capsules",high,Household,
stain remover,"vanish, napisan, oxi action, oxy action, prewash, preen, laundry booster",high,Household,
fabric softener,"fabric conditioner, laundry softener, cuddly, fluffy, softener",high,Household,
laundry sanitiser,"laundry sanitizer, clothes disinfectant, laundry disinfectant, dettol laundry",medium,Household,
sensitive,"fragrance free, hypoallergenic, hypo, gentle, unscented, ultra sensitive",medium,Household,general sensitive-search expansion
lemon,"lm, lem, lmn, citrus",medium,Household,common shelf abbreviation expansion
antibacterial,"anti bacterial, antibac, a/bact, anti-bac, disinfectant",high,Household,
eucalyptus,"eucal, euc, euco, eucalyptus scent",medium,Household,common abbreviation expansion
shampoo,"shampoo,shampo,shamp,shampu,hair wash,hair cleanser,wash hair,spoo",high,Hair Care,Common customer terms and planogram abbreviation
conditioner,"conditioner,cond,con,conditoner,hair conditioner,hair rinse",high,Hair Care,Common customer terms and planogram abbreviation
hair mask,"hair mask,mask,masque,hair masque,treatment mask,msk",high,Hair Care,
hair treatment,"hair treatment,treatment,leave in,leave-in,repair treatment,thermal treatment",high,Hair Care,
purple shampoo,"purple shampoo,silver shampoo,toning shampoo,blonde shampoo,anti brass,anti yellow",high,Hair Care,
colour care,"colour care,color care,colour protect,color protect,anti fade,dyed hair",high,Hair Care,NZ spelling and US spelling included
dry hair,"dry hair,dry scalp,moisture,hydrating,hydration,nourish,nourishing",medium,Hair Care,
damaged hair,"damaged hair,damage,repair,breakage,bond repair,protein,keratin",medium,Hair Care,
frizz,"frizz,frizzy hair,frizz control,smoothing,smooth hair,anti frizz",medium,Hair Care,
curly hair,"curly hair,curls,curl,coil,coils,wavy hair,curl care",medium,Hair Care,
oily hair,"oily hair,oily scalp,oil control,greasy hair,clarifying,detox",medium,Hair Care,
scalp care,"scalp,scalp care,itchy scalp,sensitive scalp,tonic,scalp scrub",medium,Hair Care,
volume,"volume,volumising,volumizing,body,fine hair,thin hair",medium,Hair Care,
hair oil,"hair oil,oil,argan oil,coconut oil,moroccan oil,serum",medium,Hair Care,
L'Oreal,"loreal,l'oreal,l oreal,LOreal,loreal paris",medium,Hair Care,Brand spelling variations
L'Oreal Professionnel,"loreal pro,loreal professionnel,loreal professional,serie expert",medium,Hair Care,Brand spelling variations
TRESemme,"tresemme,tresemmé,tres emme,tresseme",medium,Hair Care,Brand spelling variations
Schwarzkopf,"schwarzkopf,schwartz kopf,schwarz,swz,extra care",medium,Hair Care,Common misspellings
John Frieda,"john frieda,jf,frizz ease,sheer blonde,go blonder",medium,Hair Care,
Herbal Essences,"herbal essences,herbal essence,herbal,he,bio renew",medium,Hair Care,
Garnier Fructis,"garnier,fructis,hair food,garnier hair food",medium,Hair Care,
OGX,"ogx,organix,ogx hair",medium,Hair Care,
Maui Moisture,"maui,maui moisture,mmoi",medium,Hair Care,
Hask,"hask,hask hair,argan hask,keratin hask",medium,Hair Care,
Klorane,"klorane,chlorane,kloran",low,Hair Care,Possible misspelling
hair colour,"hair color, hair dye, dye, box dye, colour, color, permanent colour, permanent color",high,Hair Care,NZ/UK spelling plus US spelling
semi permanent hair colour,"semi permanent color, semi permanent dye, demi permanent, wash out dye, temporary dye",high,Hair Care,Common customer wording
root touch up,"root spray, root cover, grey roots, regrowth spray, retouch, touchup, touch up, magic retouch",high,Hair Care,Used for root coverage products
blonde toner,"toner, purple toner, silver toner, anti yellow, anti brass, brassiness, brassy hair, platinum toner",high,Hair Care,Blonde maintenance synonyms
bleach,"hair bleach, lightener, bleach powder, peroxide, developer, creme developer, volume developer, vol 20, vol 30, vol 40",high,Hair Care,Developer and lightener terms
colour remover,"color remover, hair dye remover, dye stripper, colour stripper, colourless, decolour, remove hair dye",high,Hair Care,Colour removal terms
black hair dye,"black hair colour, blue black, soft black, natural black, ebony black",medium,Hair Care,Shade search
brown hair dye,"brown hair colour, dark brown, medium brown, light brown, chocolate brown, chestnut, mocha, brunette",medium,Hair Care,Shade search
blonde hair dye,"blonde hair colour, ash blonde, light blonde, dark blonde, golden blonde, platinum blonde",medium,Hair Care,Shade search
red hair dye,"red hair colour, auburn, burgundy, mahogany, copper, rose gold, crimson",medium,Hair Care,Shade search
grey coverage,"gray coverage, cover greys, cover grays, white hair, grey roots, regrowth",high,Hair Care,Common need-based search
L’Oreal,"loreal, l oreal, l’oréal, loreal paris, paris excellence, preference, casting creme gloss",high,Hair Care,Brand spelling variants
Schwarzkopf,"schwartzkopf, schwarzkoph, swz, swk, live colour, brilliance, creme supreme",high,Hair Care,Brand spelling variants
Clairol,"clairal, clairol nice and easy, nice n easy, nice’n easy, n/e",high,Hair Care,Brand spelling variants
Garnier,"garnia, garnia, olia, nutrisse, garnier good",high,Hair Care,Brand spelling variants
Revlon,"revlon colorsilk, color silk, colour silk, coloursilk",medium,Hair Care,Brand/product spelling variants
Napro Palette,"palette, napro, napro hair colour, palette hair dye",medium,Hair Care,Brand and product synonyms
hair loss,"hair fall,thinning hair,balding,regrowth,hair growth,minoxidil,rogaine,men hair loss,women hair loss",high,Hair Care,
dandruff,"flakes,flaky scalp,itchy scalp,dry scalp,anti dandruff,medicated shampoo,t gel,tgel,nizoral,sebitar,selsun",high,Hair Care,
head lice,"nits,lice,nit comb,lice comb,lice treatment,lice shampoo,eggs,itchy head",high,Hair Care,
hair spray,"hairspray,setting spray,hold spray,strong hold,extra hold,ultra hold,finishing spray",medium,Hair Care,
hair styling,"styling product,hair gel,mousse,wax,paste,putty,powder,texture spray,salt spray",medium,Hair Care,
dry shampoo,"no wash shampoo,oil control,greasy hair,oily roots,refresh hair,batiste,klorane,colab",high,Hair Care,
hair dryer,"blow dryer,dryer,air styler,hot air brush,ceramic curler,curling iron,styler",medium,Hair Care,
hair brush,"brush,paddle brush,radial brush,vent brush,boar bristle brush,wet brush,detangling brush,detangler",high,Hair Care,
hair accessories,"hair ties,hair tie,elastic,elastics,scrunchie,scrunchies,claw clip,claw grip,bobby pins,hair pins,headband",high,Hair Care,
Head & Shoulders,"h&s,h and s,head shoulders,head n shoulders,headshoulders",high,Hair Care,
Schwarzkopf,"swz,schwarz,schwartzkopf,schwarzkoff,taft",medium,Hair Care,Common abbreviation SWZ appears on planogram.
John Frieda,"jf,j frieda,frizz ease,frizzease",medium,Hair Care,
L’Oreal,"loreal,l oreal,elnett,elnette",medium,Hair Care,
Got2b,"got to be,got2be,glued,ultra glued",medium,Hair Care,
Lady Jayne,"lj,lady jane,ladyjane,lady jayne brush",high,Hair Care,
heat protection,"heat protect,thermal spray,hot tool spray,straightener spray,blow dry protection",medium,Hair Care,
hair mousse,"mousse,foam,styling foam,curl mousse,volume mousse",medium,Hair Care,
hair gel,"gel,styling gel,spiking gel,ultra glued,wet look,sculpting gel",medium,Hair Care,
curl product,"curl cream,curl creme,curl gel,curl mousse,defined curls,curl spray",medium,Hair Care,
cotton tips,"cotton buds, q tips, qtips, ear buds, cotton swabs, cotton sticks",high,Personal Care,Common cotton tip search terms
cotton pads,"makeup pads, cotton rounds, cotton wool pads, facial cotton, makeup remover pads",high,Beauty,For cotton rounds and pads
cotton balls,"cotton wool balls, cotton wool, cotton ball",medium,Personal Care,
baby cotton,"baby cotton buds, baby q tips, baby cotton pads, baby applicators",medium,Baby,
travel adaptor,"travel adapter, plug adaptor, plug adapter, international adapter, power adapter, power adaptor",high,Travel,NZ spelling and US spelling
usb c,"usb-c, type c, usbc, phone charger, charging cable",high,Travel,
lightning cable,"iphone cable, apple charger, iphone charger cord, lightning charger",high,Travel,
luggage lock,"suitcase lock, travel lock, padlock, tsa lock, combination lock, combo lock",high,Travel,
luggage scale,"baggage scale, suitcase scale, bag scale, travel scale",high,Travel,
flight socks,"compression socks, travel socks, plane socks, circulation socks",high,Travel,
ear plugs,"earplugs, ear plug, noise plugs, sleep plugs",medium,Travel,
neck pillow,"travel pillow, airplane pillow, memory foam pillow, flight pillow",high,Travel,
rfid,"rfid blocker, rfid sleeve, passport sleeve, card sleeve, anti theft wallet",medium,Travel,
packing cubes,"packing cube, luggage organiser, luggage organizer, travel organiser, travel organizer",medium,Travel,
travel bottles,"toiletry bottles, travel containers, silicone bottles, squeeze bottles, cosmetic jars",high,Travel,
toothpaste,"tooth paste, mini toothpaste, travel toothpaste, colgate, dental paste",high,Oral Care,
deodorant,"deo, antiperspirant, roll on, body spray, mini deodorant",high,Personal Care,
wet wipes,"hand wipes, face wipes, cleansing wipes, feminine wipes, travel wipes",high,Personal Care,
sick bag,"vomit bag, sickness bag, travel sick bag, nausea bag, airsick bag",medium,Travel,
travel shampoo,"mini shampoo, travel hair care, shampoo travel size, conditioner mini, dry shampoo mini",medium,Hair Care,
eye drops,"eyedrops, eye drop, artificial tears, lubricant drops, dry eye drops, drops for eyes",high,Eye Care,
dry eye,"dry eyes, irritated eyes, gritty eyes, tired eyes, burning eyes, watery eyes",high,Eye Care,
allergy eye drops,"hayfever eye drops, itchy eyes, red eyes, antihistamine eye drops, allergic eyes",high,Eye Care,
red eye drops,"red eyes, redness relief, clear eyes, visine, lumify, opticrom",medium,Eye Care,
eye wash,"eye bath, eye rinse, eyewash, wash eye, dust in eye",high,Eye Care,
eye wipes,"eyelid wipes, lid wipes, baby eye wipes, cleansing wipes, sticky eyelids",medium,Eye Care,
eye patch,"eyepatch, eye patches, lazy eye patch, kids patch, pirate patch",medium,Eye Care,
contact lens solution,"lens solution, contact solution, contact cleaner, multipurpose solution, MPS, saline",high,Eye Care,
peroxide lens solution,"hydrogen peroxide lens solution, aosept, deep clean contact lenses",medium,Eye Care,
hard lens solution,"RGP solution, rigid lens solution, boston solution, hard contact lens cleaner",medium,Eye Care,
lens cleaner,"glasses cleaner, spectacle cleaner, lens wipes, glasses wipes, microfiber cloth, anti fog wipes",medium,Eye Care,
ear plugs,"earplugs, ear plug, noise plugs, sleep plugs, swim plugs, silicone plugs, foam plugs",high,Ear Care,
flight ear plugs,"airplane ear plugs, travel ear plugs, pressure ear plugs, earplanes",medium,Ear Care,
ear drops,"eardrops, wax drops, ear wax drops, earache drops, waxsol, cerumol",high,Ear Care,
ear wax remover,"wax remover, blocked ears, ear cleaner, ear spray, ear syringe, ear wax cleaner",high,Ear Care,
dry ears,"swimmer ear, water in ear, ear drying drops, dry ear spray",medium,Ear Care,
snoring,"snore, anti snore, snoring relief, sleep strips, snore strips, nose strips",high,Sleep & Snoring,
nasal strips,"nose strips, breathe right, snore strips, clear nasal strips",high,Sleep & Snoring,
mouth tape,"sleep mouth tape, anti snore tape, mouth strips",medium,Sleep & Snoring,
preservative free eye drops,"PF eye drops, single dose eye drops, vials, sensitive eye drops",high,Eye Care,
fibre,"fiber, psyllium, roughage, bowel regularity, constipation help, gut fibre",high,Medicine,Digestive health search expansion
constipation,"blocked up, cannot poo, hard stool, bowel movement, laxative, stool softener",high,Medicine,
laxative,"constipation relief, stool softener, senna, bisacodyl, dulcolax, coloxyl",high,Medicine,
haemorrhoids,"hemorrhoids, piles, rectal pain, rectal itch, anusol, proctosedyl",high,Medicine,NZ/AU spelling and US spelling
diarrhoea,"diarrhea, loose stool, gastro, runs, loperamide, imodium, gastro stop",high,Medicine,
oral rehydration,"electrolyte, electrolytes, ORS, dehydration, hydralyte, mineralyte, rehydration drink",high,Medicine,
heartburn,"acid reflux, reflux, indigestion, antacid, GORD, GERD, sour stomach",high,Medicine,
antacid,"heartburn relief, indigestion relief, reflux medicine, gaviscon, mylanta, quick eze",high,Medicine,
lactose intolerance,"milk intolerance, dairy intolerance, lactase, lacteeze, bloating after milk",medium,Medicine,
quit smoking,"stop smoking, nicotine replacement, NRT, nicotine gum, nicotine patches, nicotine spray, cravings",high,Medicine,
drug test,"drug screening, urine drug test, THC test, marijuana test, cannabis test, meth test",high,Medicine,
covid test,"COVID-19 test, RAT test, rapid antigen, flu test, RSV test, 4 in 1 test",high,Medicine,
UTI,"urinary tract infection, cystitis, burning urine, urinary discomfort, ural",high,Medicine,
travel sickness,"motion sickness, sea sickness, seasick, car sick, airsick, nausea travel, travacalm, sea legs",high,Medicine,
vomiting,"throwing up, nausea, sick stomach, anti nausea, antiemetic",medium,Medicine,
IBS,"irritable bowel syndrome, peppermint oil, bloating, cramps, bowel discomfort",medium,Medicine,
worming,"worms, threadworm, pinworm, combantrin, vermox, worm tablets",medium,Medicine,
probiotic,"gut bacteria, digestive support, bowel health, microbiome, prebiotic",medium,Medicine,
nausea,"feeling sick, queasy, vomiting, travel nausea, upset stomach",medium,Medicine,
water purification,"water purifier tablets, aquatabs, travel water, purify water",medium,Medicine,
